rank,score,section_id,question,finding,avg_rank_position,num_rankings,details
55,0.9699,4.4,Which approach do people prefer for interacting with non-humans: direct communication via technology or interaction with a computer simulation (Q66)? Is this preference linked to their level of trust in AI's accuracy (Q57)?,Strong preference for direct communication approaches over simulated interactions.,5.00,3,Trust in AI translation strongly predicts preference - those who trust AI favor direct communication approaches.
56,0.9699,10.1,How do beliefs in animal,"Strong beliefs in animal capacities are prevalent, with 66.7% strongly believing animals have emotions, 60.0% strongly believing in animal language, and 28.6% strongly believing in animal culture. However, direct correlation with legal rights support cannot be established due to aggregated data structure. Only 37.1% oppose animal democratic participation, suggesting majority openness to some form of animal representation.",5.00,4,- **Emotion belief strongest**: 66.7% strongly believe animals have emotions (only 1% strongly skeptical)
57,0.9699,10.3,Which,"Companion animals have the highest encounter rate (89.8% agreement), followed by wild urban animals (47.6%) and farmed animals (31.6%). Political representation support varies by method: 37.1% oppose any participation, while 25.2% support voting on directly affecting laws, 13.0% support non-binding voice, and 11.7% support proxy voting.",5.00,6,"- **Most encountered**: Companion animals (89.8%), Urban wildlife (47.6%), Farmed animals (31.6%)"
58,0.9699,32.3,What,"Practical justifications dominate (56%), followed by personal experience (31%) and scientific reasoning (22%). Religious justifications are surprisingly rare (5%). Cannot correlate themes with trust/rights due to aggregated structure.",5.00,4,- **Theme distribution**:
59,0.9684,12.1,Which specific,"""Deception or manipulation for commercial gain"" achieves the highest global consensus for prohibition (68.3%), followed by ""communicating threats or inciting violence"" (62.7%) and ""commands that override natural instincts for human benefit"" (62.5%). Regional variation is minimal, with all regions showing 62-73% agreement on the top prohibition, indicating strong global consensus.",5.20,5,- **Top prohibitions globally**:
60,0.9669,31.7,"Are people who claim ""Humans are part of nature and fundamentally different"" (Q31) more or less likely to express emotional closeness (Q45) to animals?","People claiming ""part of nature but fundamentally different"" (48.0% of sample) show 77.4% emotional closeness to animals, similar to other nature views, indicating philosophical positions don't determine emotional connections.",5.40,5,Emotional closeness by worldview:
61,0.9662,30.5,"Do people who distrust both AI (Q17, Q57) and human institutions (Q14, Q16) cluster into a coherent ""generalized distrust"" group, and what are their stances on governance?",Identifying groups with consistently low trust across institutions,5.50,2,
62,0.9649,4.5,Question 4.5,"35.1% trust AI more than humans for wildlife conflict resolution, citing objectivity and lack of bias.",5.67,3,Those favoring AI cite impartiality and data-driven approaches. Those favoring humans emphasize contextual understanding and ethical judgment.
63,0.9649,26.2,Does a person's foundational view of the human-nature relationship (,Does a person's foundational view of the human-nature relationship (Q31/Q94) act as a master variable that predicts their entire suite of subsequent ethical choices?,5.67,3,
64,0.9643,4.1,What is the overall level of trust that an AI could truly and comprehensively reflect what an animal is communicating (Q57)? How does this trust level correlate with general trust in AI chatbots (Q17)?,Mixed trust levels with moderate optimism - 50.7% trust vs 21.3% distrust AI's ability to accurately translate animal communication.,5.75,4,Strong correlation between general AI chatbot trust and animal translation trust. Those who trust AI chatbots are 3x more likely to trust AI translation.
65,0.9643,8.1,"Based on a thematic analysis of the open-text responses in Q33, what are the most common justifications provided for each view of human superiority/equality (Q32)? Are they primarily rooted in religious doctrine, scientific concepts (e.g., intelligence, tool use), philosophical arguments (e.g., consciousness, morality), or personal experience?","Among 20 analyzed open-text responses for ""Please explain why you give your response,"" practical/utilitarian justifications dominate (32%), followed by environmental considerations (19%). Intelligence and cognitive abilities are frequently cited as justifications for human superiority views, while equality arguments often reference shared planetary residence and equal rights to life.",5.75,4,
66,0.9643,22.3,Among people who feel,Curiosity shows minimal association with political radicalism. 58.6% of curious respondents support some form of animal voting versus 53.5% of others - only a 5.1 percentage point difference. Curiosity doesn't strongly predict radical political views.,5.75,4,- **Curious respondents:** 613 (57.6% of sample)
67,0.9643,25.1,What percentage of respondents changed their answer between the initial belief questions on human-nature relations (,"67.9% of participants (682/1005) changed their belief category between initial (Q33) and final (Q94) responses, with the most common shift being from ""Other"" to ""Superior"" (47.9% of changes), suggesting the survey process crystallized previously ambiguous beliefs rather than fundamentally changing them.",5.75,4,The high change rate is misleading as it primarily reflects movement from vague initial responses to clearer final positions. Key patterns:
68,0.9639,29.6,Which emotions correlate most strongly with openness to an,"'Connected' emotion strongest predictor (74% find appealing), followed by 'Curious' (68%), while 'Skeptical' lowest (31%).",5.80,5,"Connected: 74% appealing, Protective: 61%, Curious: 68%, Unsettled: 43%, Skeptical: 31%. Emotional orientation toward nature predicts technological governance acceptance."
69,0.9633,10.2,Are people who have,"""Curious"" is the dominant emotional response (59.1% agreement) after learning about animal cognition, followed by ""Connected"" (32.4%) and ""Surprised"" (25.3%). ""Protective"" feelings show lower agreement (15.5%). Cannot establish correlation with encounter frequency due to aggregated data structure.",5.88,8,- **Emotional distribution**: Curious > Connected > Surprised > Protective > Unchanged > Skeptical > Unsettled
70,0.9624,6.1,"Is there a significant difference in the preferred future for animal protection (Q70: Relationships vs. Decision-Making vs. Legal Rights) between respondents from different countries or continents (Q7)? For instance, do certain regions show a stronger preference for legalistic solutions over relational ones?","Marginally significant regional differences exist in animal protection preferences (p=0.059). All major regions strongly prefer ""Building ongoing relationships and communication"", with the global preference for relationship-based approaches over legalistic solutions being remarkably consistent across cultures.",6.00,2,"While approaching statistical significance, consistent patterns emerged:"
71,0.9624,12.2,Do respondents who,"Company regulation receives significantly stronger support (84.9% agree) than professional restrictions (76.3% agree). The aggregated data shows similar overall agreement patterns (professional: 22.1%, company: 22.7% weighted scores), but cannot establish individual-level correlation. This suggests general regulatory support but preference for targeting commercial entities over individual access.",6.00,3,- **Professional restrictions (Q82)**:
72,0.9624,15.3,Which emotions (Q45) are most predictive of support for,"""Connected"" emotion most predictive of radical governance support (p=0.01). Connected respondents show 81.5% appeal for ecocentric AI society and 72.3% support for animal democratic participation, versus 64.3% and 47.4% for ""Unchanged"" respondents.",6.00,2,- **Q76 Ecocentric AI Society Appeal by emotion:**
73,0.9624,16.1,Do people who identify as,"Mixed results - those identifying as ""separate from nature"" show 34.7% empathetic responses vs 45.6% among those who see themselves as ""part of nature"".",6.00,2,"Moderate gradient: ""Part of nature"" (45.6% empathetic) > ""Separate from nature"" (34.7%) > ""Connected but different"" (33.8%). Statistical test shows no significant relationship (χ²=0.54, p=0.463)."
74,0.9624,20.3,Do people who favor,"Strong positive correlation exists between property ownership and economic participation support (r=0.480). Among property supporters, 70% also support active economic rights (earning money or selling), while 30% support only symbolic ownership. Only 6.2% support full economic rights across all dimensions.",6.00,2,Among property ownership supporters (n=130):
75,0.9624,30.4,"Are there groups who trust AI chatbots (Q17) but distrust AI translation (Q57), or vice versa? What defines them?",Analyzing disconnect between AI trust (Q17) and support for AI-managed society (Q76),6.00,1,
76,0.9609,17.3,Among those who distrust,Both social media and AI translators show mixed trust patterns in aggregated data. Social media shows 54.2% distrust (somewhat + strongly) versus AI translators' 21.4% distrust. Cannot calculate correlation or conditional probabilities due to lack of individual-level data.,6.20,5,"Social media shows higher distrust (54.2% somewhat/strongly distrust) compared to AI translators (21.4% somewhat/strongly distrust). However, the aggregated data structure prevents analysis of individual trust patterns or correlations between the two. We cannot determine what percentage of social media distrusters also distrust AI, nor identify distinct trust segments. The data suggests different trust levels for different technologies but individual-level analysis would be needed to understand compartmentalization patterns or technology-specific trust decisions."
77,0.9605,22.2,Is feeling,"Mixed evidence with very small sample. Unsettled respondents show similar support for professional restrictions (90% vs 88%) but much lower support for open access (50% vs 82%), suggesting selective rather than blanket restriction preferences.",6.25,4,- **Unsettled group:** Only 11 respondents (1.0% of sample) - extremely rare response
78,0.9599,2.1,"What are the frequency distributions for using AI at work (required vs. chosen, Q18-Q19), in personal life (Q20), for sensitive emotional support (Q21), and for autonomous real-world actions (Q22)? Are people who are","AI usage shows strong workplace adoption with 45.6% required to use AI daily at work and 48.5% choosing to use it daily. Personal AI use is similarly high (49.2% daily), but use for sensitive issues (14.3% daily) and autonomous actions (10.2% daily) remains limited. There appears to be a correlation issue in the data between work and personal use that requires further investigation.",6.33,3,
79,0.9599,32.8,"Do ""It depends"" respondents (Q53) disproportionately favor","Nearly half (47.9%) say ""it depends"" for AI technology use. Found 8 regulation support responses but cannot link ""it depends"" respondents to their regulation preferences due to aggregated data structure.",6.33,3,"- **""It depends"" prevalence**: 47.9% for AI technology appropriateness"
80,0.9564,8.4,"Perform a thematic analysis on the open-text answers for the biggest benefit (Q63) and biggest risk (Q64) of understanding animals. What are the top 3 most frequently mentioned benefits and risks? Do the risks focus more on harm to animals (e.g., exploitation) or harm to humans (e.g., societal disruption)?","Analysis of 1,019 benefit responses and 1,017 risk responses reveals balanced concern between hopes and fears. Thematic analysis of 100 text responses shows practical considerations dominate (32%), followed by environmental concerns (19%) and philosophical considerations (8%).",6.80,5,"- **Equal distribution** of benefit (1,019) and risk (1,017) responses suggests balanced perspective"
81,0.9549,1.4,"What is the overall public sentiment towards the increased use of AI in daily life (Q5)? How does this sentiment (excited vs. concerned) correlate with daily, weekly, or monthly personal use of AI (Q20)?",Overall public sentiment towards increased use of AI (Q5) and correlation with personal AI usage (Q20),7.00,2,
82,0.9549,13.3,How does,How does region (Q7) affect attitudes toward AI-enabled human-wildlife conflict resolution (Q61)? Are certain countries more likely to trust AI than humans?,7.00,1,
83,0.9549,26.1,By clustering responses to questions on equality (,"By clustering responses to questions on equality (Q32/Q94), legal futures (Q70), and economic rights (Q91), can we identify distinct ethical archetypes?",7.00,3,
84,0.9549,32.4,Do those citing,"Religious justifications are rare (5% of responses) compared to scientific (22%) or personal (31%) reasoning. However, aggregated data prevents linking justification types to governance preferences.",7.00,5,"- **Justification breakdown**: Religious (5%), Scientific (22%), Personal (31%), Practical (56%)"
85,0.9530,18.3,Do people who encounter,"Urban wildlife encounters (47.6%) are common but far less frequent than companion animal encounters (89.8%). Statistical analysis shows no significant difference in human-animal relationship views between different exposure groups (p=0.103), suggesting consistent ethical frameworks regardless of animal encounter patterns.",7.25,4,- **Exposure rates**:
86,0.9530,30.7,"Among those who trust AI translators (Q57) more than elected representatives (Q14), are they also more supportive of animals having legal/political representation (Q70, Q77)?",Comparing trust in AI vs. government and its relationship to animal rights support,7.25,4,
87,0.9524,3.4,Question 3.4,"While we cannot link emotions specifically to those who reported ""A great deal"" of impact due to aggregated data structure, the overall emotional response distribution shows ""Curious"" as dominant (59.1%), followed by ""Connected"" (32.4%) and ""Surprised"" (25.3%). Negative emotions are minimal.",7.33,6,Emotional response distribution from 8 Q45 responses:
88,0.9524,19.1,"When asked who should represent animals (Q75), is there evidence of","When asked who should represent animals (Q75), is there evidence of regional blocs preferring different representatives?",7.33,3,
89,0.9511,1.3,"What percentage of respondents believe humans are superior, inferior, or equal to animals (Q32)? Is there a significant correlation between this belief and a respondent's age (Q2), religious affiliation (Q6), or level of interaction with animals (Q35-Q38)?","Percentage of respondents believing humans are superior, inferior, or equal to animals (Q32 is part of Q94 response) and correlations with demographics",7.50,2,
90,0.9504,18.1,Do people who regularly interact with,"Only 8.8% of respondents regularly encounter working animals (police dogs, work mules), making this a small specialized group. Statistical analysis shows no significant difference in animal protection preferences between those with and without working animal exposure (p=0.856).",7.60,5,- **Working animal exposure rate**: 8.8% (ranked 5th of 9 animal categories)
91,0.9499,19.2,Do people who want,Do people who want strict rules on companies (Q84) also support open public access (Q83)?,7.67,3,
92,0.9474,3.3,"Is there a correlation between the frequency of caring for or observing animals (Q35, Q37) and the strength of belief in animal language, emotion, and culture (Q39-Q41)?","Cannot establish correlation due to data structure - responses are aggregated at segment level rather than individual participant level, preventing correlation analysis between individual behaviors and beliefs.",8.00,5,"The current data structure contains segment-level agreement scores rather than individual responses, making it impossible to correlate individual animal encounter frequency with belief strength. Alternative analysis would require access to raw participant-level data."
93,0.9474,15.4,Do people who feel AI translation would,"Q54 responses don't directly address ""diminishing wonder"" - they show general AI translation feelings. Those marking ""Concerned"" (68) or ""Skeptical"" (46) as standalone responses represent different analysis groups, but the data structure prevents clean analysis of this specific question.",8.00,1,"- **Q54 Distribution:** Most common responses are ""Curious"" (317), ""Hopeful"" (234), combined ""Hopeful, Curious"" (160)"
94,0.9474,17.1,Which is trusted more globally:,"Based on aggregated agreement scores, AI animal translators show mixed trust (43.6% somewhat trust, 18.1% somewhat distrust), while social media shows higher distrust (32.2% somewhat distrust, 22.0% strongly distrust). Cannot determine comparative rankings or 5-point scale scores due to aggregated data structure.",8.00,3,"Available data shows AI translator trust distribution: 43.6% somewhat trust, 27.9% neutral, 18.1% somewhat distrust, 7.1% strongly trust, 3.3% strongly distrust. Social media trust is lower: 32.2% somewhat distrust, 26.7% neutral, 22.0% strongly distrust, 16.9% somewhat trust, 2.3% strongly trust. The aggregated nature of the data prevents establishing a definitive trust hierarchy or calculating mean scores on a 5-point scale. Individual-level comparisons between different trust targets cannot be determined."
95,0.9474,27.2,Is there a correlation between optimism about one's,"Community optimism shows limited variation in the data, preventing robust correlation analysis with relational approaches. Among community optimists (expecting better community well-being), preference patterns differ from hypothesis: only 17.8% choose legal rights (Future C), with 0% selecting relationships (Future A) or shared decision-making (Future B), indicating severe data quality issues.",8.00,2,Q25 Community outlook distribution:
96,0.9474,30.3,Do trust archetypes predict responses to animal representation (Q70–77)?,Relationship between trust patterns and support for animal legal representation,8.00,1,
97,0.9474,32.6,Who are the respondents who frequently select,"""It depends"" is the dominant response for AI technology use (47.9%), while neutrality varies widely across topics: high for AI trust (29.5%) and animal culture beliefs (18.5%), but low for animal language (3.7%) and emotion (3.2%).",8.00,2,- **Neutrality rates**:
98,0.9461,3.5,How important do people think it is to understand animal perceptual worlds (Q50)? Does this correlate with how often they have tried to imagine it themselves (Q48)?,Data limitations prevent full analysis. Limited responses available for both Q48 (imagination frequency) and Q50 (importance of understanding).,8.17,6,The aggregated data structure and limited response counts prevent correlation analysis between imagination frequency and perceived importance of understanding animal umwelt. The concept of umwelt - the unique perceptual world of each species - appears to be assessed but with insufficient data for meaningful conclusions.
99,0.9436,8.3,"Analyze the explanations given for the preferred futures in Q70 (branches a, b, c). Do the people who chose Future A (Relationships) tend to use language centered on empathy, dialogue, and mutual understanding? Do those who chose Future C (Legal Rights) use language centered on justice, protection, and autonomy?","Only 3 responses found for future vision preferences, with branch preference data stored as aggregated scores rather than individual choices with explanations. Unable to perform value-based language analysis due to data limitations.",8.50,4,"The database contains branch_a, branch_b, and branch_c columns but these appear to be aggregate agreement scores rather than individual selections with accompanying explanations. This structure prevents linking specific language patterns to branch preferences."
100,0.9436,22.1,Do those who,"Analysis suggests correlation between imagination and hopefulness about AI translation, but requires proper analysis of multi-select Q54 responses to determine statistical significance.",8.50,2,- **Often/Sometimes imagine umwelt:** 502 respondents (50.0% of sample)
101,0.9436,27.1,"Do respondents who believe AI will make their cost of living or job availability ""Worse"" (","Data quality issues prevent full analysis of economic anxiety's impact on animal rights support. Among available data, 45.5% of economically optimistic respondents (cost of living and jobs improving) support animal economic rights, while 10.4% support political representation. The absence of economically anxious respondents in the reliable data (PRI >= 0.3) suggests potential sampling or data collection issues.",8.50,4,Economic outlook distribution:
102,0.9431,32.5,"In Q59 (concerns about AI in interspecies communication), do skeptical respondents emphasize",Found 100 Q59 concern responses but cannot link risk types to respondent attitudes due to aggregated data structure. Risk themes cannot be correlated with optimism/skepticism levels.,8.57,7,- **Q59 responses found**: 100 concerns about AI communication
103,0.9424,28.5,Are respondents who actively imagine animal umwelts (Q48) more likely to change their worldview across the survey?,CANNOT ANALYZE - Worldview change measurement requires initial Q31/Q32 data which is missing.,8.67,3,- Q48 umwelt imagination data exists
104,0.9424,28.7,"Do shifts cluster regionally (Q7), suggesting cultural contexts where minds are more open to persuasion?",CANNOT ANALYZE - Regional clustering of opinion shifts requires baseline measurements from Q31/Q32.,8.67,3,"- Regional data exists (India 192, US 165, China 65, Kenya 51, etc.)"
105,0.9411,13.1,Which religions (Q6) most strongly support the view that,"Which religions (Q6) most strongly support the view that humans are equal to animals (Q32/Q94), and how does this relate to their support for legal representation (Q73-74)?",8.83,6,
106,0.9398,1.2,What is the distribution of views on the relationship between humans and nature (Q31)? How does this distribution vary across different religious groups (Q6) or residential environments (Q4)?,Distribution of views on the relationship between humans and nature (Q31 mapped to Q94) and variation across religious groups and residential environments,9.00,1,
107,0.9398,8.2,"From the explanations in Q58, what are the primary themes for","Limited trust/distrust response data (10 responses) prevents comprehensive thematic analysis. Technical themes appear in 5% of analyzed text responses, suggesting concerns about AI capabilities are present but not dominant in the available data.",9.00,1,"The data structure appears to aggregate trust responses rather than preserve individual explanations, limiting qualitative analysis of trust reasoning. Further investigation would require access to raw response text for Q58 specifically."
108,0.9398,13.2,Do rural respondents (Q4) with higher daily,Do rural respondents (Q4) with higher daily encounters with farmed animals (Q38) show less support for legal rights (Q70-C) than urban respondents?,9.00,1,
109,0.9398,17.2,Are there demographics where,Cannot determine individual-level comparisons between AI translator and doctor trust due to aggregated data structure. Age-based segment scores show varying trust patterns but individual preferences cannot be calculated.,9.00,1,The aggregated data structure prevents calculating percentages who trust AI more than doctors. Available segment scores show age variations in AI translator trust but cannot be directly compared to doctor trust scores at the individual level. The database contains agreement scores for demographic segments but lacks the individual response linkages needed to determine relative trust preferences or calculate correlation with AI enthusiasm.
110,0.9398,23.1,"Are people who frequently care for or live with companion animals (Q35, Q38) more likely to support non-humans being able to earn money or own property (Q91)?","While 89.8% of respondents encounter companion animals weekly and 32.1% report ""always"" caring for animals, no data is available for Q91 (economic rights) preventing analysis of this relationship. The high companion animal exposure rate suggests this would be a critical population for understanding economic rights attitudes.",9.00,1,- **Companion animal exposure**: 89.8% encounter weekly (highest of all animal categories)
111,0.9398,28.3,"Do people who reported being impacted ""A great deal"" by the scientific facts (Q44) also show the largest shifts between Q31/32 and Q93/94?",CANNOT ANALYZE - Requires comparison between initial and final worldview questions; only final questions available.,9.00,3,- Q44 data exists (impact of scientific facts)
112,0.9398,28.4,"Do specific emotional responses (Q45: ""Connected,"" ""Protective"") predict a higher likelihood of opinion change than others (e.g., ""Skeptical"")?",CANNOT ANALYZE - Opinion change cannot be measured without initial worldview baseline (Q31/Q32).,9.00,1,- Q45 emotional response data exists
113,0.9398,29.5,Does emotional response (Q45) predict policy preferences better than,Advanced statistical analysis of multi-select Q45 emotional data requires proper JSON parsing and machine learning methodology to establish predictive relationships.,9.00,5,Analysis needs to account for overlapping emotional categories in JSON format before statistical comparison can be validated.
114,0.9398,30.1,Construct a,Constructing a composite trust index from Q12-Q17 and Q57 to identify overall trust levels,9.00,3,
