rank,score,section_id,question,finding,avg_rank_position,num_rankings,details
115,0.9380,3.2,What is the distribution of responses regarding how much the provided scientific facts about animal cognition (Q43) impacted respondents' perspectives (Q44)?,Unable to determine exact distribution due to limited response data. Only 5 responses recorded for Q44 in the database.,9.25,4,"The limited data suggests varied impact levels from the scientific facts presented about dolphins, parrots, elephants, orangutans, prairie dogs, and humpback whales. Further data collection needed for meaningful analysis."
116,0.9361,5.3,"Of the options provided in Q75, which three roles (e.g., Scientists, Animal protection organizations, AI) are most frequently chosen to represent animals in decision-making bodies?","Data quality issue detected - all representative options show 100% selection, suggesting a data processing error in the unmapped columns. Unable to determine actual preferences from current data structure.",9.50,4,PENDING: Requires investigation of data structure for multi-select questions. The uniform 100% selection rate across all options indicates either a data import issue or that these columns contain different information than expected. Further investigation needed to properly analyze representative preferences.
117,0.9361,28.1,How many respondents changed their answers between the,"DATA LIMITATION - Initial worldview questions Q31-Q32 are not present in the database. Only final questions Q93-Q94 exist, making it impossible to measure within-survey opinion change.",9.50,2,"- Q93 exists: Contains human-nature relationship views (separate/part of nature, different/similar)"
118,0.9361,28.6,"Is there a generational difference in opinion shifts (Q2), i.e. are younger respondents more ""persuadable"" than older ones?","CANNOT ANALYZE - Age-based persuadability analysis requires measuring actual opinion change, which is impossible without Q31/Q32 baseline.",9.50,4,- Age distribution data exists
119,0.9361,30.2,What clusters emerge from trust patterns — e.g.,Identifying distinct trust archetypes through cluster analysis,9.50,4,
120,0.9348,28.2,"Among those who shifted, what proportion moved",CANNOT ANALYZE - Requires Q31/Q32 baseline data which is not available in the database.,9.67,3,- Analysis not possible without initial worldview data
121,0.9323,1.1,"What is the demographic breakdown of the survey respondents based on age (Q2), gender (Q3), location type (Q4), and religious identification (Q6)?","Demographic breakdown of survey respondents based on age (Q2), gender (Q3), location type (Q4), and religious identification (Q6)",10.00,1,
122,0.9323,1.5,"How does trust in AI chatbots (Q17) compare to trust in other entities like family doctors (Q12), elected representatives (Q14), and social media feeds (Q13)? What is the average trust level for each entity?",Comparative trust levels across different entities (Q12-Q17),10.00,1,
123,0.9323,12.3,How many respondents select,No data available for Q75 (animal representative preferences) in the current dataset. Unable to compare preferences for animals themselves versus scientists or NGOs as decision-making representatives.,10.00,1,"The question about who should represent animals in decision-making bodies appears to be missing from the available response data, preventing analysis of representative preferences across regions."
124,0.9323,12.4,Are younger respondents (Q2: 18–25) more likely than older respondents (56+) to support animals having,No data available for Q91 (economic agency) in the current dataset. Unable to determine age-based differences in support for animals earning money or owning property.,10.00,6,"The question about animals' economic rights appears to be missing from the available response data, preventing age-based analysis of economic agency support."
125,0.9323,32.1,Do respondents who predict AI will make,"Cannot establish correlation due to missing data. While economic outlook questions exist (10 responses found), no Q91 (economic agency) data and limited Q73 data prevent analysis of the relationship between economic anxiety and animal rights support.",10.00,2,- **Economic outlook data**: 10 responses found for AI impact on jobs/cost of living
126,0.9323,32.7,Are neutrals more likely to become,No data available for Q93-Q94 (repeated worldview questions) preventing analysis of survey intervention effects on neutral respondents.,10.00,1,- **Missing data**: No Q93-Q94 responses found in database
127,0.0000,5.2,"Should an animal have the right to a legal representative (Q73)? And if so, should they be represented by humans or by themselves via technology (Q74)?","42.5% support animals having legal representatives, with 34.1% unsure and 23.4% opposed. Among supporters, 58.3% prefer human representatives while 41.7% support technology-assisted self-representation, showing significant openness to technological mediation.",N/A,0,"The high uncertainty (34.1% ""Not sure"") suggests this is an emerging ethical question many haven't considered. The substantial minority (41.7%) supporting tech-assisted self-representation indicates openness to radical new forms of agency. This split between human mediation and technological autonomy reflects broader debates about AI's role in expanding agency beyond traditional human boundaries."
128,0.0000,7.4,Question 7.4,"Strong belief in animal culture correlates with increased support for radical political representation (12.7% vs 3.6% among skeptics), but the relationship is marginally non-significant (p=0.065). Belief in animal culture doesn't strongly predict political radicalism, suggesting cultural recognition and political inclusion are separate considerations.",N/A,0,Among strong culture believers (n=284):
129,0.0000,9.1,Question 9.1,"Tech-First Futurists (20.2% of respondents) are significantly more appealing to ecocentric AI societies (28.4% find it ""Very appealing"" vs 16.6% general pop, p=0.0009) and more supportive of open access to animal communication (67.6% vs 60.8%, p=0.047), but show similar risk concerns.",N/A,0,
130,0.0000,14.1,What percentage of people globally believe,"59.5% of people globally support some form of animal participation in democratic processes, with 25.2% supporting limited voting on directly relevant laws and 21.5% supporting full voting rights through proxies or formal constituencies. Support is highest among suburban residents (60.6%) and females (60.6%).",N/A,0,Forms of democratic participation supported:
131,0.0000,19.3,How many respondents support an,"How many respondents support an AI-managed ecocentric society (Q76), and are they the same people who are skeptical about AI in daily life (Q5)?",N/A,0,
132,0.0000,30.6,"Are there religious or cultural groups (Q6, Q7) that show distinct trust profiles, e.g., higher faith leader trust but lower AI trust?",Trust patterns by religious affiliation,N/A,0,
133,0.0000,32.2,Do those who feel their,"Community optimism is prevalent (54.9% expect improvement), but cannot be linked to support for relational approaches due to missing branch-specific data in Q70. The positive community outlook suggests potential openness to collaborative approaches.",N/A,0,- **Community well-being expectations**:
