Category,Tag 1,Tag 2,Tag 3,Tag 4,Tag 5,Tag 6,Tag 7,Tag 8,Tag 9
AI Integration in Daily Tasks and Services,AI chatbots replacing human customer service,"AI for financial, travel, and shopping tasks",AI in home automation and smart devices,AI in social media and online content,,,,,
Concerns about Accuracy and Authenticity,Concerns about authenticity and misinformation,Need to double-check AI outputs for accuracy,,,,,,,
Content Creation and Creativity,AI for creative tasks and idea generation,"AI in content creation (text, images, video)",,,,,,,
Human-AI Interaction and Social Impact,Frustration with AI replacing humans,Reduced human interaction in services,,,,,,,
Information Access and Productivity,AI assistance with writing and editing,AI for decision-making and comparisons,"AI for language, translation, and accessibility",AI for research and learning support,AI in education and academic support,AI-generated summaries in search engines,Faster access to information and answers,Increased productivity and efficiency,Time savings on routine and admin tasks
Minimal or No Impact,No noticeable change or minimal impact,,,,,,,,
Normalization and Societal Perception,General normalization and ubiquity of AI,Increased reliance or dependency on AI,,,,,,,
Personal Assistance and Wellbeing,AI as a personal assistant or companion,"AI for health, fitness, and wellbeing advice","AI for planning, scheduling, and organization",Emotional support and mental health from AI,,,,,
Workplace and Employment Effects,AI in workplace tools and workflows,Job impacts and employment concerns,,,,,,,
Uncategorized,Other,,,,,,,,
,Uninformative answer,,,,,,,,
