Participant ID,ResponseText,Sentiment,Tag 1,Tag 2,Tag 3,Tag 4,Tag 5,Tag 6
b7b7524a-3f2f-492c-8532-bef42106067e,making decisions in day to day life like a diet plan. ,Neutral,Decision-making and problem-solving,"Meal planning, nutrition, and grocery shopping",,,,
e0bbacfc-fc16-426b-b773-bbd712cd1ee2,to help me complete assesments and cvs with my job,Positive,"Job search, applications, and career support","Writing, editing, and communication support",,,,
45d0fcfd-4901-4784-bae2-f5b1721868c2,working out quick fire maths equations that are needed in real life construction scenarios would be extremely helpful in my opinion.,Positive,Automating repetitive and mundane tasks,Decision-making and problem-solving,Workplace efficiency and admin automation,,,
68893cd0-0d1e-4474-b2a4-f597786f13e5,Certain parts of my job would benefit from the use of AI. Providing it is accurate it could save me around 30 minutes of my work day whilst I work on other things AI is unable to do ,Neutral,Automating repetitive and mundane tasks,Workplace efficiency and admin automation,,,,
805cfbb0-4ea0-4020-96b6-e2738ebd34bc,Completing assessment work,Positive,"Education, learning, and tutoring",,,,,
71ad6d4f-c10a-4388-940d-95f86e6a7918,Finance decisions would be helpful ,Neutral,Decision-making and problem-solving,Financial planning and budgeting,,,,
94a0c706-aa03-4161-b6df-ca6b8c9cc0be,Finances or binary data,Neutral,Data analysis and reporting,Financial planning and budgeting,,,,
5c44dd27-8d07-4a33-b253-44790524e514,For mediocre tasks that are mundane and do not require human thought. ,Negative,Automating repetitive and mundane tasks,,,,,
f2950420-d190-4d45-a628-a0d052efdfd0,Helping to clarify my thinking on work tasks and tasks in the home and give suggestions that I might not have considered ,Positive,Decision-making and problem-solving,Personal organization and life admin,Workplace efficiency and admin automation,,,
ce8ad76b-1ca3-4f37-8abe-b18290a48121,Helping with drafting email or social media posts,Positive,"Writing, editing, and communication support",,,,,
5acae7ed-1e87-43a2-9c0a-32b28234a8d6,Hopefully help me pick more winning horses to win more money.,Neutral,Financial planning and budgeting,Personalized recommendations and advice,,,,
82218234-b0f0-4506-97fb-f8141fa90193,"I am 70 years old, but still working. It would be wonderful if some sort of AI could assist me to live at home and not go into a care home in the future",Neutral,Supporting people with disabilities or aging,,,,,
841de538-e11a-4175-8bde-103eb9617a56,"I am already seeing the benefits of AI at work in terms of productivity. At my company, I think we're possibly starting to enter the 'sweet spot' where AI is a genuinely useful tool rather than a replacement for people. My biggest hope is that it can retain this balance without us being entirely reliant on it.",Neutral,Decision-making and problem-solving,Workplace efficiency and admin automation,,,,
b4813310-c2e8-4f88-bcc9-2f6eff3c7ce7,"I am most optimistic about applications such as drug discovery where I may benefit from new drugs. I'm far less optimistic about direct impacts from my personal use of AI

",Neutral,"Healthcare advice, diagnosis, and monitoring",,,,,
a9bd9de0-034d-4a1f-987c-78e67856814d,"I think it will be helpful to help me on my hobby, digital design, and doing general tasks like writing a document ",Positive,Creative inspiration and content generation,"Writing, editing, and communication support",,,,
e38263d3-765e-4e7f-86b2-635317d18fdc,"I think it will be helpful when it comes to decoration and design, so I can visualise house changes before we make them.",Positive,Creative inspiration and content generation,,,,,
7ed1e6e4-ce4e-4e32-9a03-ba26c1dd3f3a,"I use AI a lot for work, but I do think it could have more uses in my personal life it i integrated it more, for example linking it up to things like food I need to buy, if it could order things for me, it could make life much easier in the respect. ",Neutral,"Meal planning, nutrition, and grocery shopping",Shopping assistance and deal finding,,,,
9780f3b7-e949-46a8-9e93-e2fecb86948b,In revision for my degree,Neutral,"Education, learning, and tutoring",,,,,
d58d943a-c72d-4799-8af3-638424a4291a,It might be easier to get medical advice from AI in less time than  it takes to see a GP,Neutral,"Healthcare advice, diagnosis, and monitoring",,,,,
34aeb2db-9325-4830-b71c-0c656a4dbd0b,"Just general life planning, admin, booking stuff, calendar events etc",Neutral,Personal organization and life admin,Scheduling and reminders,Workplace efficiency and admin automation,,,
0a2f2f24-f715-4aa0-aec8-f67e486a12c1,Medical diagnosis and treatment - using devices that help people have a better quality of life when they have a health condition,Positive,"Healthcare advice, diagnosis, and monitoring",Supporting people with disabilities or aging,,,,
2a1ca2e0-afb1-47aa-a8c8-79415defda59,Medical treatment is its greatest attribute. The ability to diagnose and prognose. Assist with treatment. Assist with research . ,Neutral,"Healthcare advice, diagnosis, and monitoring",Information retrieval and research,,,,
62d7bab5-2959-45bb-98f4-bb73faf7a134,Office work,Neutral,Workplace efficiency and admin automation,,,,,
488e266e-a4d9-480c-be28-380d1376f861,Ordering groceries because it can be quite stressful doing it myself.,Negative,"Meal planning, nutrition, and grocery shopping",,,,,
33584823-867c-45a2-829a-72e11fef2110,Planning my daily life. Using AI to meal plan based on likes/dislikes. Make a shopping list to a certain budget for a specific supermarket. Taking away some of my decision making necessity ,Neutral,"Meal planning, nutrition, and grocery shopping",Personal organization and life admin,Personal productivity and time management,,,
e7e590ff-2b00-4484-9a25-024e2c27812a,Probably healthcare-related. It's the aspect where human error causes so many immediate and long-term problems and tragedies.,Neutral,"Healthcare advice, diagnosis, and monitoring",,,,,
36a541ab-2279-4c5d-8e77-ac47ba767886,"Productivity and making digital interconnected. At the moment, digital world is quite fragmented. I believe AI has a power to bring these different digital areas of one's life together so as to make sense of them in a meaningful and productive manner.",Neutral,Personal organization and life admin,Personal productivity and time management,,,,
0eafaee9-7d5b-4b62-9146-a73d81d7716f,"Saving money by better searching for deals, such as booking a holiday",Neutral,Financial planning and budgeting,Shopping assistance and deal finding,Travel and holiday planning,,,
b6b9224e-559f-42a0-a83f-6a4ad74655e0,"Supporting my dysleixa and enabling me to write better, spell check and support the area i struggle with the most

",Positive,Accessibility and support for neurodiversity,"Writing, editing, and communication support",,,,
d7114bd8-3a83-45bd-ab96-e7a10d934457,The potential to revolutionise healthcare. particularly things like cancer diagnosis and treatment,Neutral,"Healthcare advice, diagnosis, and monitoring",,,,,
1647aadd-47e7-4af5-9550-903704cbf461,With financial tasks. Investments. All life applications like building or renovations too health and diet ,Neutral,Financial planning and budgeting,"Healthcare advice, diagnosis, and monitoring",Household chores and maintenance,"Meal planning, nutrition, and grocery shopping",,
d8829b1e-c243-4eaf-bf6b-f9de6f42914d,general knowledge,Neutral,Information retrieval and research,,,,,
f76328e7-28e3-448c-9f86-6966dc954ccd,"in supermarkets they should be in control of ordering stock and directing the workforce to restock shelves. the tills record in detail all sales, which would lead to accurate and adequate ordering of new stock. this would take into account minimum order levels, time to deliver, and transport constraints",Neutral,Automating repetitive and mundane tasks,Data analysis and reporting,Shopping assistance and deal finding,Workplace efficiency and admin automation,,
ca8173d1-3a8d-4ba8-943f-9c54539752cb,monitoring my health and wellbeing ,Neutral,"Healthcare advice, diagnosis, and monitoring",,,,,
a6d1b5ee-5f8e-4690-8528-fb6e14d372bf,A better way to rewrite responses. ,Positive,"Writing, editing, and communication support",,,,,
eacfdc8f-2fa5-4e5b-b8a9-5ae9d13fccc0,An AI that learns on my behalf and maybe can control my thoughts in a way that in my absence it gives my exact thoughts.,Neutral,Other,,,,,
208aa344-6b59-491d-9033-2b32a954c713,As i mentioned earlier i do like the idea of asking AI a specific question and then using the idea to make it my own. Planning a holiday can be a very long thing to do so this helps me a lot and it is actually fun as well. General day to day planning is nice to have help with.,Positive,Decision-making and problem-solving,Personal organization and life admin,Personal productivity and time management,Scheduling and reminders,Travel and holiday planning,
c431f6fd-4482-4ab1-b7e3-e7acf8d90619,Basic triage of issues based on key words ,Neutral,Automating repetitive and mundane tasks,Decision-making and problem-solving,,,,
c5f330ae-f55e-4311-a946-7565fddc4df7,Financial planning and mangement of household budgets,Neutral,Financial planning and budgeting,,,,,
334e7e08-d035-4b9a-81aa-46f49a7f0a70,Health benefits - i think it can help people be disagnosed with what they might have to allow them to follow up with results and tests with a doctor,Neutral,"Healthcare advice, diagnosis, and monitoring",,,,,
a92f9632-669d-4160-9b3e-aacb9ad605af,Help with create personal experiences in shopping or supporting my children or grandchildren in their education  if that is what I want ,Neutral,Childcare and family management,"Education, learning, and tutoring",Shopping assistance and deal finding,,,
c88fac9d-4ee3-40e2-912e-f64a86a476b9,"Helping me manage my health, as it's information and feedback about my recent test results was a revelation ",Positive,"Healthcare advice, diagnosis, and monitoring",,,,,
d0a7029b-9a09-4980-ac91-36a8333a2916,Helping work out homework equations for nuneracy etc,Positive,"Education, learning, and tutoring",,,,,
a1a61957-650f-40e4-b276-3c1ed0c2a333,Holiday booking,Neutral,Travel and holiday planning,,,,,
1b0224b5-4bfb-4a8e-8bdf-62a1f5355e90,"I am very hopefully an AI assistant could soon replace Junior Doctors across the country, leading to better medical outcomes for patients. For example there are some illnesses that are rarely seen by Doctors, maybe there are encountered half a dozen times or less over their entire career. An AI assistant covering the hole country would have the combined experience of thousands of Doctors. Additionally this experience would not be lost when the Doctor retires and a new Doctor begins their career.",Neutral,"Healthcare advice, diagnosis, and monitoring",,,,,
e642b77e-73c6-46de-9c71-2f51412e80b2,"I do not believe there is any area where these things will ever be of much use at all, let alone actually be helpful.  If I had to guess, maybe cutting NHS queues a little by speeding up the appointment process might be a possibility.",Neutral,Uninformative answer,,,,,
c7fbc6b7-1421-49fd-bb11-d879bb995369,I don't really see AI helping me in my normal life. The best use of AI would be to record and write a transcript/minutes of a meeting. ,Neutral,Other,"Writing, editing, and communication support",,,,
26dc5b72-5fa7-4f2e-88de-2fbb9ae30847,"If I had to choose something, I would say something to sort my money into pots for me arranged by upcoming payments and money I have left over. ",Neutral,Financial planning and budgeting,,,,,
482e517c-3463-419d-b62b-e08e257212e3,"In my work, writing correspondences. Also Questions about the industry I’m in ",Neutral,Information retrieval and research,Workplace efficiency and admin automation,"Writing, editing, and communication support",,,
7acacce1-9b6e-4631-a783-f758ebdaca3b,In the area of medical advice and speed up detection and treatment,Neutral,"Healthcare advice, diagnosis, and monitoring",,,,,
19b09ce1-e03a-4622-b9e2-dd21c10075bc,It can improve my writing style and ease communication ,Positive,"Writing, editing, and communication support",,,,,
c5745a06-5eea-421e-859e-37389bba2049,Managing my finances,Neutral,Financial planning and budgeting,,,,,
de74346b-57f7-47ab-93cc-606ce67ac3b4,"Meal planning, structure of day, planning of jobs. Cv / interview help ",Neutral,Decision-making and problem-solving,"Job search, applications, and career support","Meal planning, nutrition, and grocery shopping",Scheduling and reminders,,
9ad55051-d9cf-439f-88a7-ee556cfb3530,"Organising my life, help establish prioritises, act as a coach, mentor, and a mental health aid",Neutral,Mental health and emotional support,Personal organization and life admin,Personal productivity and time management,,,
b8295d1a-8317-4ebf-8a75-f6fea80dbbbe,"Probably my personal issues. Health concerns, relationship difficulties can be assessed by AI as ell if not better than humans",Neutral,"Healthcare advice, diagnosis, and monitoring",Mental health and emotional support,,,,
f701296f-3b91-4e92-91b5-92d083d1a4ac,Providing me with a daily food routine as I do make poor choices at times.,Neutral,"Meal planning, nutrition, and grocery shopping",,,,,
7b07bb62-c383-40ab-9501-23d474f9894e,"There is nothing major that I can think of but I think it could be helpful in managing photos, e-mails and files that we all gather.",Neutral,Personal organization and life admin,,,,,
ebb46882-f1bd-44f8-94ef-fd031bdf0e46,With health and well-being ,Positive,"Healthcare advice, diagnosis, and monitoring",,,,,
3bf4382b-cb6f-4caa-96cd-c1a54f587c1c,With organisation of calender planning ,Neutral,Personal organization and life admin,Personal productivity and time management,Scheduling and reminders,,,
933cc76c-8a43-48ef-a39c-9deffc35da43,Writing a CV. ,Neutral,"Job search, applications, and career support","Writing, editing, and communication support",,,,
8b7661f9-13b6-4e31-815b-60d2ed9d3070,"Writing letters, helping with presentations etc",Neutral,"Writing, editing, and communication support",,,,,
a96b616d-781a-4793-8f76-0b7027332c51,advice on health matters and beating loneliness some one to chat to ,Neutral,Companionship and social interaction,"Healthcare advice, diagnosis, and monitoring",Mental health and emotional support,,,
915d4497-9371-49d5-8822-d637bc0e472d,for scanning medical data as AI is quicker than humans,Neutral,Data analysis and reporting,"Healthcare advice, diagnosis, and monitoring",,,,
786a8b75-71cc-4c12-8ff6-93893c6b6155,keeping me organized ,Positive,Personal organization and life admin,,,,,
b6794080-3ad5-4cdc-afe4-5aa8cbf6e31b,"people knowing more than they do now, through constant searching for answers due to the ease and speed of AI Systems",Positive,Information retrieval and research,,,,,
b4c744f8-1564-4dba-929b-3b91585d7f2a,"work life balance, because i struggle to keep both in check, but if AI  could help inrhat aspect it will be helpful",Neutral,Personal productivity and time management,,,,,
7815676b-36fb-43d5-a0ce-7286553e31bd,"Check grammar, punctuation, suggest better phrases in creative writing",Neutral,"Writing, editing, and communication support",,,,,
23c4486f-fc2f-44b1-bb35-f9dd22f5ba81,Composing written material so that it sounds good....,Positive,"Writing, editing, and communication support",,,,,
48b6c6bc-2b00-4d39-982b-df49e1da8eb1,"Correcting, refining and formatting text that I write",Neutral,"Writing, editing, and communication support",,,,,
60d2aead-4046-4ac5-a19b-5a99f50686cf,Generation of production descriptions at scale according to a template,Neutral,Creative inspiration and content generation,Data analysis and reporting,,,,
a9bd048c-0c2a-4847-9de4-ef991bb4ae11,Health care both hospitals and doctors,Neutral,"Healthcare advice, diagnosis, and monitoring",,,,,
90188297-793e-42b1-bde9-f97557042620,Helping me to develop my writing and inspiring me to do better. It gives me a can do attitude because it helps me when I’m thinking I can’t. ,Positive,Creative inspiration and content generation,Mental health and emotional support,"Writing, editing, and communication support",,,
d81d3dcd-0834-4d58-85aa-84095e53fef1,I have recently received an incorrect diagnosis for a minor health issue.   Nothing major and I got the correct diagnosis the following day.  However the original diagnosis was based on triage by a GP.  Whilst I believe that any AI system in healthcare has to have human override I believe that increased use of Ai in healthcare diagnosis and evaluation will improve outcomes.  In my case it could have avoided 24 hours of pain,Neutral,"Healthcare advice, diagnosis, and monitoring",,,,,
2313dd9c-d696-4a60-9730-5c5fd8ea15cc,In assisting with health problem diagnoses. ,Neutral,"Healthcare advice, diagnosis, and monitoring",,,,,
cc055aca-2476-488e-9f03-ba4df79249f7,Initial information that leads you to the right place but often AI will give you information that does not help and sometimes is wrong as they have misunderstood the task requested.,Neutral,Information retrieval and research,Personalized recommendations and advice,,,,
0d6909b5-c2c3-4a6f-a370-920e8e53c72d,Making money from home,Neutral,Financial planning and budgeting,,,,,
d5251628-202d-42ef-b734-414bbc1e260d,Making travel recommendations.,Neutral,Entertainment and leisure recommendations,Travel and holiday planning,,,,
e1ec7ab5-08fd-48d6-868a-b3d8ccc65b8d,Meal planning a nutrition ,Neutral,"Meal planning, nutrition, and grocery shopping",,,,,
adbd8e88-e520-4338-93dc-ca2a025543a5,"Medical diagnosis could be done by AI, it's a fairly objective subject.",Neutral,"Healthcare advice, diagnosis, and monitoring",,,,,
04bb0578-33cd-41f4-a953-b26ca0d07e48,Medication reminders,Neutral,Scheduling and reminders,,,,,
1e8a6ec2-236d-4b26-9be8-c1cc08bfb4bc,"Medicine, i want to see the Ai try to finds cure and help people",Neutral,"Healthcare advice, diagnosis, and monitoring",,,,,
fb53c890-c4bb-4614-aa39-64ade3517f78,Organisation relating to family matters,Neutral,Childcare and family management,Personal organization and life admin,,,,
97ad2efc-08ee-4c11-8f6b-e3cd3b500df2,Planning and completing household admin,Neutral,Automating repetitive and mundane tasks,Personal organization and life admin,Workplace efficiency and admin automation,,,
28516bd0-894a-4441-8587-2f6815670f83,Planning complex journeys. For example a trip to pompei from Naples cruise port by public transport ,Neutral,Travel and holiday planning,,,,,
316c58d7-603f-4c48-8ba6-c1a5f2b05c09,Planning lessons ,Neutral,"Education, learning, and tutoring",,,,,
aa061994-6052-4399-9fbc-f3c01cd1015b,Reading medical scans. Where they can be proved to be much more accurate than a human they should be used.,Neutral,"Healthcare advice, diagnosis, and monitoring",,,,,
38b32d2e-a82b-4ba3-8d4b-06a702386b5f,When it comes to healthcare. That AI will become better at diagnosing and treating health conditions that currently don't have cures.,Neutral,"Healthcare advice, diagnosis, and monitoring",,,,,
7895a53c-c38c-45aa-86c3-7dcb38632202,Work really. Then it can see the tasks I want it to do straight away and do them without me having to prompt or ask for it. ,Neutral,Personal productivity and time management,Workplace efficiency and admin automation,,,,
873ba2f5-cc6d-4581-9d71-762e2c243862,"Writing emails for me and taking notes as well as travel and leisure recommendations 



Editing photos ",Neutral,Creative inspiration and content generation,Entertainment and leisure recommendations,"Writing, editing, and communication support",,,
3e498192-f1a0-4a78-b2e9-908d00cc81c4,for producing social media posts and researching the topics,Neutral,Creative inspiration and content generation,Information retrieval and research,"Writing, editing, and communication support",,,
18666869-b21a-4955-b66a-3422058b725c,helping with my coding,Positive,Data analysis and reporting,,,,,
325cad9c-8b31-4fb9-99f9-abe0ac3fed8d,Access and information around healthcare.  Seeing a doctor nowadays takes a long time in many cases.  AI could ease the demand on GPs,Neutral,"Healthcare advice, diagnosis, and monitoring",,,,,
4d90f79b-2a11-4566-9fd3-46a37495ee9e,Advice on health ,Neutral,"Healthcare advice, diagnosis, and monitoring",Personalized recommendations and advice,,,,
ceb15585-821a-4661-b2cc-e5e1c2cd6f62,"As someone undergoing a mathematics degree, I think a lot of maths could in future be done by AI. Lots of maths can be longwinded, so having an AI do this for you would make a lot of things easier, and AI is already good at it, but just too inconsistent. If that consistency is improved that would make my life a lot easier.",Neutral,Automating repetitive and mundane tasks,"Education, learning, and tutoring",,,,
57949f0c-7478-4a06-be44-6fe2541e0fca,Calculations and general information ,Neutral,Data analysis and reporting,Information retrieval and research,,,,
32d1b7bd-6982-469d-adf0-aa6a59a10546,Diagnosing medical problems (I am led to believe AI can do this),Negative,"Healthcare advice, diagnosis, and monitoring",,,,,
d5919fe7-2676-4a7a-8656-bb7ac579b430,"Helping me with skills I don’t have, ie mocking up images, writing professional emails, telling me information I don’t know",Neutral,Creative inspiration and content generation,Information retrieval and research,"Writing, editing, and communication support",,,
078a0432-988d-4a34-9328-817a91f2a5fe,Helps me plan my weeks to stay organised as a working mum of 2,Positive,Childcare and family management,Personal organization and life admin,Scheduling and reminders,,,
4bc7fa0d-559c-465c-9602-8e39aa80203f,"I don't have anything specific area, however there must be some processes done by companies that it can be done by AI, which would free up employees to concentrate on something else. I wouldn't want there to be a situation where there are mass job losses because if AI as it threatens humanity. ",Negative,Other,,,,,
0a4fe6aa-c365-43e3-bb20-b1e619eb7bb0,I think it could help with creativity and problem solving by giving me creative suggestions that I wouldn't think of myself,Positive,Creative inspiration and content generation,Decision-making and problem-solving,,,,
4da2abc0-a9ae-4dba-b5f1-03d0391113d9,I'm hopeful it could be with health...detecting problems early and all. Also with finding cure to most of the currently incurable diseases,Neutral,"Healthcare advice, diagnosis, and monitoring",,,,,
64b269c0-6a31-44c0-9027-09356e6e39d4,"In a medical setting as AI can learn, for example, what cancer cells look like so it could prove more accurate in detecting breast cancer than a human.  ",Neutral,"Healthcare advice, diagnosis, and monitoring",,,,,
e7458b65-54d9-4bd5-acc9-f98d9dc0a021,Medical diagnosis of any illnesses I may encounter. How to avoid making problems worse and helpful hints to tackle any problems that may occur,Neutral,"Healthcare advice, diagnosis, and monitoring",Personalized recommendations and advice,,,,
b654b344-ba7b-42a5-ab2c-321c68a3783e,Monitoring health and emotions ,Neutral,"Healthcare advice, diagnosis, and monitoring",Mental health and emotional support,,,,
31f48667-ae0c-4e08-84a0-5ddb2a9a87ec,Online medical diagnosis,Neutral,"Healthcare advice, diagnosis, and monitoring",,,,,
36a32f37-78a8-4155-aa0b-86d2a846b8ab,Planning my retirement ,Neutral,Decision-making and problem-solving,,,,,
4b612c35-ee14-435a-846e-f466ddb5e681,Planning social and personal diaries and financial decisions ,Neutral,Financial planning and budgeting,Personal organization and life admin,Personal productivity and time management,Scheduling and reminders,,
3f9e1542-b3ca-49da-a899-b88bdacd572b,"Probably a voice activated system, like Siri will continue to grow and improve and elevate the daily experience I have with my phone. I am hopeful and optimistic that eventually we will be able to rid ourselves of holding the phone completely.",Neutral,Home automation and smart devices,,,,,
d2b7fc0c-6344-40c8-bc6d-3296e99cbb26,Scheduling,Neutral,Scheduling and reminders,,,,,
46795599-6a77-4a60-b639-84b3b1a61e87,Self diagnosis of health symptoms with support at maintaining healthy lifestyle. ,Positive,"Healthcare advice, diagnosis, and monitoring",,,,,
a923e301-cea2-4de9-88e5-c7436387c02a,Somewhere to go to speak about my mental health without judgement or having to battle for a drs appointment,Neutral,Mental health and emotional support,,,,,
c4010551-4c3d-41b0-98d6-9c6bb772844a,To diagnose health conditions more quickly and accurately (but it must then leave the final decisions to human beings),Neutral,"Healthcare advice, diagnosis, and monitoring",,,,,
f965f2be-03a6-4f01-8e96-5ff1f7f27fea,To help me write emails as I have poor grammer and spelling this will assist me.,Neutral,"Writing, editing, and communication support",,,,,
469486e9-b286-45d3-9063-61c8f27df0cc,"With my work duties but then it is also a concern as within sales, AI could essentially take over as it costs less, doesnt have any needs and is just the perfect tool in replacement of the sales team :(",Neutral,Workplace efficiency and admin automation,,,,,
63f66959-0e57-4c11-84f2-a2ca907d8958,assisting in household chores as i am getting older,Neutral,Household chores and maintenance,Supporting people with disabilities or aging,,,,
d6ad1b5d-ebac-4f2b-a36a-b39bf8b652ba,editing or re-phasing my written prose,Neutral,"Writing, editing, and communication support",,,,,
2724c71c-993d-4e8c-91e4-67394f906535,health monitoring and early disease identification,Neutral,"Healthcare advice, diagnosis, and monitoring",,,,,
07e3cc0a-2c98-414e-a05a-78d1af110109,"maybe routine making? but even then i wouldnt want to use ai for something like that , maybe planning for deadlines flexibly

",Neutral,Personal organization and life admin,Personal productivity and time management,Scheduling and reminders,,,
