Participant ID,ResponseText,Sentiment,Tag 1,Tag 2,Tag 3,Tag 4,Tag 5,Tag 6
7acac877-27ce-4de8-a992-98df84d9383a,I think AI could a fabulous tool for research and for automation of routine work tasks such as drafting emails/creating reports etc. I also think it has the potential to positively impact on the lives of our clients (adults with learning disabilities) who could be supported to be more independent with the use of AI led accesibility technologies,Neutral,Accessibility and support for neurodiversity,Automating repetitive and mundane tasks,Information retrieval and research,Supporting people with disabilities or aging,"Writing, editing, and communication support",
0d76c522-80e4-4153-a3ab-a817b97efd46,"I think AI has great potential to assist with plans, like holidays and trips away. It already has the ability to give alternative options based on certain criterias",Neutral,Personalized recommendations and advice,Travel and holiday planning,,,,
b472ec28-b2d6-4800-ba93-61c0ecbc2944,"I think AI would be great for typical everyday use of information, guidance and giving company to those that need it. I have used AI a couple of times when asked to do so by survey's. I found the information given by AI was extremely useful. ",Neutral,Companionship and social interaction,Information retrieval and research,Mental health and emotional support,,,
df2f12e5-646c-40f9-98a3-576f20a0cbe5,"I think an AI assistant could be most helpful in relation to my hobbies. I expect I could tell it what, for example, what kind of place I would like to go for a walk and the conditions to be met; and that it would quickly find something useful. This would save me hours of internet searching.",Neutral,Entertainment and leisure recommendations,Travel and holiday planning,,,,
b54b0e1e-56d3-472d-9c0b-e5bc5397b1e7,"I think it will be in my work life, it will give me more time and a chance to understand things that I may not get usually time to read. It can also help sort chaos of normal life by arranging my diary in a more efficient way. ",Positive,Information retrieval and research,Personal organization and life admin,Personal productivity and time management,Scheduling and reminders,,
efacbbd3-ee8a-4308-bfd6-51d0185fc8b8,I think it would be most helpful in sorting life admin so constantly searching for the best utility deals ,Positive,Personal organization and life admin,Shopping assistance and deal finding,,,,
26244c6b-50bd-450f-9429-7dc146cf646b,"I think the technology could transform the lives of disabled people eg voice activated, hands free assistants",Neutral,Accessibility and support for neurodiversity,Supporting people with disabilities or aging,,,,
001632c0-163a-4eec-b522-dcfff42cc1d2,I think when it comes to learning and breaking down large amounts to information into a more digestible way to make it easier to understand plus having the ability to ask it to provide extra information or clarify anything you don't understand.,Neutral,"Education, learning, and tutoring",Information retrieval and research,,,,
0ae0aa96-7f47-433d-baff-9dfd7e300d0c,"I would have to say helping with general information searches, medical information, banking, shopping, travel information, weather, the list is endless really. ",Neutral,"Healthcare advice, diagnosis, and monitoring",Information retrieval and research,Shopping assistance and deal finding,Travel and holiday planning,,
fdc9b11f-8839-4481-af8a-1a4376262cb8,"I'm most optimistic about an AI assistant that could help me achieve a better work-life balance. I imagine it could automate repetitive tasks like scheduling, email filtering, and even personal errands. This would free up a significant amount of my time and mental energy, allowing me to focus on more meaningful work and personal activities, leading to a healthier and more sustainable routine.",Neutral,Automating repetitive and mundane tasks,Personal organization and life admin,Personal productivity and time management,Scheduling and reminders,,
ac564383-cd06-49e5-9c82-dd81f8fae981,"If it could take in all tasks, appointments, bills, things like that and organising it into a life schedule. Do certain things for you in the background, then i think it could streamline your life and give you more freedom to do more things you enjoy doing.",Neutral,Automating repetitive and mundane tasks,Personal organization and life admin,Scheduling and reminders,,,
039f8a4c-72e3-4f92-b66c-ce979be2ba65,"In completing administrative tasks and automating repetitive jobs. If the AI can not do this directly, it can build an app that completes the task or gives as much assistance as possible.",Neutral,Automating repetitive and mundane tasks,Workplace efficiency and admin automation,,,,
49f71083-cc58-4bca-828b-1104a25ea2b1,"In doing everyday admin tasks such as collaring flight prices, recommending restaurants and booking appointments ",Neutral,Personal organization and life admin,Scheduling and reminders,Shopping assistance and deal finding,Travel and holiday planning,,
a69b11ad-ea16-412a-90f6-5c88b29b8e9c,In helping with day to day tasks and problem solving,Positive,Automating repetitive and mundane tasks,Decision-making and problem-solving,,,,
13158016-5090-4888-986f-292506eba954,In increasing productivty for work and studies.,Neutral,"Education, learning, and tutoring",Personal productivity and time management,Workplace efficiency and admin automation,,,
29c05fff-244e-4e57-9fbb-1c7b0757cbed,"In my work life, it can support me with research, writing reports and accessing information.",Positive,Data analysis and reporting,Information retrieval and research,Workplace efficiency and admin automation,"Writing, editing, and communication support",,
0118f9c0-9d58-48dd-8210-7e91612e34bb,It could be helpful to organise your life and propose ways to improve your daily life,Neutral,Personal organization and life admin,Personal productivity and time management,Personalized recommendations and advice,,,
4e55060c-4eb7-4cdb-96bb-67615cbb1f40,It could be useful as a quick diagnosis tool which could be used to get urgent treatment for conditions or injuries quickly before a doctor can arrive ,Neutral,"Healthcare advice, diagnosis, and monitoring",,,,,
8c516369-4b3a-4943-9083-327e95bb01a5,"It could help people in older age, as it might be able to help with automatic lights etc.",Neutral,Home automation and smart devices,Supporting people with disabilities or aging,,,,
9550c5a4-2943-4ae6-afae-5e464a404d16,It could possibly reduce the amount of menial work people do freeing people up to train in more skilled work ,Neutral,Automating repetitive and mundane tasks,"Education, learning, and tutoring",,,,
97317cf9-b79e-4b88-a77c-8fe6d1593987,"It would be genuinely helpful, and would be an optimistic hope, if all information provided by an AI assistant were accountable to some Regulatory Authority.  Appropriate regulation would provide more optimism and trust.",Neutral,Legal and policy information simplification,,,,,
2a160d06-3698-4aa2-8e24-bf25dc506f20,"I’m most optimistic that a future AI assistant could help with organising and managing daily tasks, like scheduling, reminders, and keeping track of appointments. It would save time and reduce mental load.",Neutral,Personal organization and life admin,Personal productivity and time management,Scheduling and reminders,,,
18556901-fa38-42f9-8b3a-1c635f14147f,"Just day to day task management, things such as controlling appliances, pulling together info etc. ",Neutral,Automating repetitive and mundane tasks,Home automation and smart devices,Information retrieval and research,Personal organization and life admin,Personal productivity and time management,
7aa27d2b-8eb2-44c8-b424-71ce93777cb2,"Just helping me day to day with queries and organisation. Like an advanced, personalised google",Positive,Information retrieval and research,Personal organization and life admin,Personal productivity and time management,Scheduling and reminders,,
60c6d5f0-a172-42f2-8f73-f6874d8e1e06,Keeping track or organising my life. For example booking appointments for me when jt is convenient for health checks or vehicle checks ecr.,Neutral,"Healthcare advice, diagnosis, and monitoring",Personal organization and life admin,Scheduling and reminders,,,
35baf671-513e-4aa8-9baa-a785885402ae,"Management tasks, dealing with my team and their progression ",Neutral,Decision-making and problem-solving,"Meal planning, nutrition, and grocery shopping",Workplace efficiency and admin automation,,,
17af3147-21b5-4426-b331-ffa941ecb830,"Managing my time better, general day to day advice on purchases for necessary items to buy online and get delivered. Much easier than visiting shops looking for the best product.",Positive,Personal productivity and time management,Shopping assistance and deal finding,,,,
a0917ff9-088d-487e-8b53-ee07f70d1042,"Managing someone’s daily routine, their diary, traffic to work and route suggestions etc. making someone’s life more seamless",Positive,Personal organization and life admin,Personal productivity and time management,Scheduling and reminders,,,
d0df7876-d8b0-4ea4-8cde-b723b434752a,Mostly being able to complete simple monotonous work tasks easier and quicker. ,Positive,Automating repetitive and mundane tasks,Workplace efficiency and admin automation,,,,
4c7cb5fe-0cc5-476b-aded-7227fb25d903,My job. Hands down has helped me work faster and more efficiently and I just hope that my work doesn't get automated and that it just helps me more. ,Neutral,Personal productivity and time management,Workplace efficiency and admin automation,,,,
605e679d-357d-41d0-861f-bc52f9a4672a,Optimisation - removal of the spurious waste that is ingrained into society. ,Neutral,Automating repetitive and mundane tasks,,,,,
8b60ce8f-7181-4e93-b60c-eb18c5fc5132,"Organisation of benign work tasks and the opportunity to better plan my work day, optimising my time.",Positive,Automating repetitive and mundane tasks,Personal organization and life admin,Personal productivity and time management,Workplace efficiency and admin automation,,
77d7c456-3b0d-45a9-810e-498d1868bcb6,"Organisation, like chores and scheduling. ",Neutral,Household chores and maintenance,Personal organization and life admin,,,,
68097c67-0bdd-4c44-9d52-44f30e8f1fa1,"Organising my life, giving me help on how to manage day to day tasks ",Positive,Personal organization and life admin,Personal productivity and time management,,,,
b56ab02e-3b31-425b-b758-cc6dc24c7342,"Personally just for information and finding out things I don't know, at the moment I think think this is most helpful and enjoyable for me ",Positive,Information retrieval and research,,,,,
2469a80a-de1a-4767-b95a-dbdd895e1ca8,"Potentially speed up meanial tasks, like listing speeds of writing phrases at work.",Neutral,Automating repetitive and mundane tasks,Workplace efficiency and admin automation,,,,
344b555f-3241-4f93-b963-61a3da6e7091,Preparing reports at work.,Neutral,Data analysis and reporting,Workplace efficiency and admin automation,,,,
2e346114-94da-4f55-a2f0-9d25d6a8892f,"Prioritise my tasks, helping in how to accomplish my tasks with innovative ideas.",Positive,Decision-making and problem-solving,Personal productivity and time management,,,,
28931a2f-0284-46ea-94af-c811493f534b,Probably Maths. Its really helpful and good in it. ,Neutral,"Education, learning, and tutoring",,,,,
5756f645-fef4-4230-a758-c0e4397693ae,"Problem solving, budgeting and helping to find the best deals on products.",Positive,Decision-making and problem-solving,Financial planning and budgeting,Shopping assistance and deal finding,,,
d1a88bee-a8b9-4f14-ace0-97c736e24148,"Productivity and organisation. Also just general knowledge, I often ask AI questions about random things I want to know.",Neutral,Information retrieval and research,Personal organization and life admin,Personal productivity and time management,,,
ea244f27-b8a2-4aff-9e2f-8dea3df0ddde,Productivity. Helping to do tasks like plan for the week ext,Neutral,Personal organization and life admin,Personal productivity and time management,,,,
a25dd336-7de7-4fbd-a1eb-330b2ee976fe,Providing information and advice to support everyday decisions at home and at work.,Positive,Decision-making and problem-solving,Information retrieval and research,Personalized recommendations and advice,,,
db608965-46e9-44c1-9346-40ba136a1a5c,"Really helpful in communication. Think it can help in my sector, healthcare, a lot. Can make decisions that are somewhat basic without human error. ",Neutral,"Healthcare advice, diagnosis, and monitoring","Writing, editing, and communication support",,,,
d4858464-d5fe-49a3-86b6-48889fecd5a3,"Repetitive, administration tasks",Neutral,Automating repetitive and mundane tasks,,,,,
45938af8-8c02-4a8f-bff3-ff3ad747ce93,Report writing at work. Editing and rephrasing wording that would take me considerably more time which I don’t get paid for . ,Neutral,Data analysis and reporting,Workplace efficiency and admin automation,"Writing, editing, and communication support",,,
1a62ac10-14a2-4ce5-8add-a6aaf375e484,"Routine tasks like grocery shopping, managing finances and research. ",Neutral,Automating repetitive and mundane tasks,Financial planning and budgeting,Information retrieval and research,"Meal planning, nutrition, and grocery shopping",,
3aa389e7-5b10-47d0-999e-b48f2eb73bc3,Scheduling different meetings I have going on would be a massive benefit to me,Positive,Scheduling and reminders,,,,,
29cbcc33-2256-4a5d-8356-1e9c3c6c986d,"Self driving cars - improve traffic flow, reduce injuries, accidents and insurance costs.",Neutral,Home automation and smart devices,"Safety, security, and crime prevention",,,,
dfd27e09-9fbb-4c07-9943-798bb001fbeb,"Shopping, bill paying, direct debit, appointments, schedules, health monitoring",Neutral,"Healthcare advice, diagnosis, and monitoring","Meal planning, nutrition, and grocery shopping",Scheduling and reminders,Shopping assistance and deal finding,,
54e8c934-3d35-4bec-8fa0-906f7eff03de,Software Development and automation of tedious tasks,Neutral,Automating repetitive and mundane tasks,Workplace efficiency and admin automation,,,,
56e0108e-c54b-4da1-ada9-887af8dec60a,"The running of routine household tasks (managing dates of appointments, creating shopping lists, giving me reminders etc)",Neutral,Automating repetitive and mundane tasks,Personal organization and life admin,Scheduling and reminders,,,
ab8a774a-637a-45cb-ac7a-d72ee085e458,"Time saving task such has completing forms, admistrative tasks ",Neutral,Automating repetitive and mundane tasks,Personal organization and life admin,Personal productivity and time management,,,
f2434a68-809c-4f41-bf34-d8465dcc15e7,"To help me with my small business a side hustle, giving me tips on marketing ideas, product ideas, even event ideas where I can show off my small business.",Positive,Creative inspiration and content generation,Workplace efficiency and admin automation,,,,
109a34a5-c0d1-4694-b9b6-1b91b3d63c27,"To help with household tasks like cleaning, administration reminders",Neutral,Household chores and maintenance,Personal organization and life admin,,,,
677cda7e-7270-4557-80e4-17037d281c94,"To organise things, find information",Neutral,Information retrieval and research,Personal organization and life admin,Personal productivity and time management,,,
56212c3c-3e16-4a27-b973-70faf58dc945,"Transcribing and formatting words, phrases etc.",Neutral,Automating repetitive and mundane tasks,"Writing, editing, and communication support",,,,
2543088f-42e8-4ce8-8d32-f30074d7abca,When i am wanting to learn advanced things when it comes to learning how to code programmes,Neutral,"Education, learning, and tutoring",,,,,
31f66a99-0c31-4306-b2c6-b0a954f50879,filling in forms,Neutral,Automating repetitive and mundane tasks,,,,,
b0f2e8c4-88f1-491d-a8ac-96ab913620f3,"help people more ,organise appointments give tips on better wellbeing answer queries and questions and be more personalised to ones needs if requested",Positive,Household chores and maintenance,Personalized recommendations and advice,Scheduling and reminders,,,
85e34caa-7a89-4243-8f86-654ee9961e19,helping disabled people to carry out tasks,Positive,Supporting people with disabilities or aging,,,,,
7b72d3e2-ac2b-4ff9-9f55-d4a9e5ffc399,helping manage my day to day tasks,Positive,Personal organization and life admin,Personal productivity and time management,,,,
cf2ba6df-979a-4a24-8b4d-33cdce6dab3a,helping me save time by completing tasks on my behalf,Positive,Automating repetitive and mundane tasks,Personal productivity and time management,,,,
69838f3f-ddd8-4e21-9340-fe877212199f,i believe it could be helpful in the medical sense where it can gather lots of information quickly and give a good answer but also alongside human interaction too ,Positive,"Healthcare advice, diagnosis, and monitoring",,,,,
4dd90a34-27f4-40b0-a49d-b70045b04397,in job creation or implementing great business ideas for me. it can also be useful in my daily tasks assigned to me too.,Positive,"Education, learning, and tutoring","Job search, applications, and career support",Personal organization and life admin,,,
569ea421-f844-4456-bf52-85d877dbaffa,in my work to automate my tasks,Neutral,Automating repetitive and mundane tasks,Workplace efficiency and admin automation,,,,
09346dfc-bf4d-4c59-9fb7-fc70f9ecd5f6,"organising my routine, ",Neutral,Personal organization and life admin,Personal productivity and time management,Scheduling and reminders,,,
fba9fbc0-3178-4353-86b9-a28180b811ee,A chat buddy. An assistant that is always available for a chat and can use information I willfully provided to plan my day with my consent. ,Neutral,Companionship and social interaction,Personal organization and life admin,Personal productivity and time management,Scheduling and reminders,,
8ed9d2c3-f92a-4dc6-8f3f-9071f5c11b40,"A personal assistant who can manage household and work-related tasks, such as ordering groceries and planning meals. They could help with gardening, identifying what's wrong with a plant, and they could also help you identify the issue with any devices you own, or give you a set of personalised instructions on a task you don't know how to complete.",Neutral,Household chores and maintenance,Information retrieval and research,"Meal planning, nutrition, and grocery shopping",Scheduling and reminders,,
8f8f91cb-5890-4c4c-9af0-6b59c54a3e8e,Access to knowledge and resources ,Positive,Information retrieval and research,,,,,
617837e2-f6ab-49aa-9661-487712c73e82,"Admin tasks - finding things to do with my family, planning food shops, planning holidays, making bookings on our behalf, planning travel times ",Neutral,Automating repetitive and mundane tasks,Childcare and family management,"Meal planning, nutrition, and grocery shopping",Personal organization and life admin,Scheduling and reminders,Travel and holiday planning
55ba38c8-d8fe-4309-9327-23cef18ddab7,An AI assistant could be helpful to me in the area of career development and job transitions.,Neutral,"Job search, applications, and career support",,,,,
5d79a91c-d6d7-4c9b-9c1e-004eb93b8d29,Answering routine email queries.,Neutral,"Writing, editing, and communication support",,,,,
26635b20-2d2e-4af1-b9f2-1fc862d78c86,Automation and fact checking ,Neutral,Data analysis and reporting,Information retrieval and research,,,,
de2991d5-e221-4cce-9dc6-32c577c1ee10,Automation of repetitive tasks that lack creativitiy,Negative,Automating repetitive and mundane tasks,,,,,
c450be04-ab2e-4f20-b2f9-89a5fa3729cb,"Be an all in one system that works across all devices, PC, mobile and a universal Alexa type device for home automation. So no need to have different apps to control different things and remember different past conversations or tasks",Neutral,Home automation and smart devices,Personal organization and life admin,,,,
a80ff8b8-ca08-4e8d-9fb8-7504676d27ab,"Capabilities of planning of events, organizing and booking them in a structured and reliable manner.",Positive,Scheduling and reminders,Travel and holiday planning,,,,
9d55be09-6584-47db-894d-3f31e5495bdf,Carrying out work for me such as finding a suitable product based on a brief that I've given it.,Neutral,Automating repetitive and mundane tasks,Shopping assistance and deal finding,,,,
04b719c9-dd87-4356-b08c-5171e72fc939,Everyday tasks such as creating shopping lists,Neutral,Automating repetitive and mundane tasks,"Meal planning, nutrition, and grocery shopping",,,,
35a2aca7-f229-4d7b-9209-3d3438b0ca0f,"Finding and collating information about real world events much easier than I could, e.g. gigs, fairs, festivals, or even job vacancies etc.",Positive,Information retrieval and research,"Job search, applications, and career support",,,,
b1e23c6c-039c-4f6c-b0fe-b24a593cb3e3,"Finding information online, asking questions and finding tailored responses ",Neutral,Information retrieval and research,Personalized recommendations and advice,,,,
401c9215-eaee-489c-9b76-93db8c2603a5,Generating a schedule for the week to allow for better task management.,Neutral,Personal productivity and time management,Scheduling and reminders,,,,
8ee44560-9cfa-4666-8109-6a9f471c696d,"Helping me file my online self assessment for tax. In a broader sense, helping me complete those kind of tasks that are time consuming data compilers, like the tax returns",Positive,Automating repetitive and mundane tasks,Data analysis and reporting,Financial planning and budgeting,Personal organization and life admin,,
d569067b-01bd-4935-bd39-781c2b3bd4a7,"I believe that it will help me to develop my knowledge and understanding in a more efficient way. It will be a useful learning tool, and almost become a life-long teacher.",Positive,"Education, learning, and tutoring",,,,,
fec648c8-92b2-4c17-a103-2679cfb952b0,"I do think AI is incredibly helpful when it comes to organising your workload for emails, reports and general communication but I don’t think people should become entirely dependent on it",Neutral,Personal productivity and time management,Workplace efficiency and admin automation,"Writing, editing, and communication support",,,
d5521a4d-c764-472d-b937-60ef78c9fe15,I think AI would be useful with help on finding the best utility bills for a more cost effective solution,Neutral,Financial planning and budgeting,Shopping assistance and deal finding,,,,
68c35f2b-4c0d-4275-a865-616048ef57fd,"I think AI's ability to summarise large documents or meeting notes will save me some time at work, but I'd have to work together with AI and still check the summary. I'd also need to be able to trust that is has summarised everything effectively. I wouldn't want to be reliant on AI and would only use it for admin tasks, rather than big projects. But it could be very helpful at work when it comes to efficiency. ",Neutral,Automating repetitive and mundane tasks,Personal productivity and time management,Workplace efficiency and admin automation,,,
31a8392c-0f53-4594-90a1-829761d7066d,I think helping with my wellbeing and suggesting help and areas where I can improve aspects of my life. Offering practical advice based on its own data and knowledge about resources and successes for other people,Positive,Mental health and emotional support,Personalized recommendations and advice,,,,
5ef9af7b-1684-41e3-b7b0-b73a20da6baf,"I think the most helpful use of an AI for me would be in structuring emails. Sometimes I’m not sure how to word formal emails, so having an AI assistant either proofread or rewrite it would help a lot. This would also be the case for job applications. I believe AI would be beneficial in the proofreading and editing process so I can adequately demonstrate my skills.",Neutral,"Job search, applications, and career support","Writing, editing, and communication support",,,,
2fb66351-f165-4575-8670-6add3629ea50,"If AI could keep tabs on my spending and create reports to show me how much I've spent and by category, it would save me a lot of time in going through all my bank statements and creating this myself. It would give me greater flexibility",Neutral,Data analysis and reporting,Financial planning and budgeting,,,,
20ea7251-f639-4cab-bf81-6cff8bf14867,"If I have another job on the side, or my own little business for example, I believe it could be very useful in helping me with all the legal stuff, including tax etc",Neutral,Financial planning and budgeting,Legal and policy information simplification,,,,
2ee15d5f-11d7-4ef5-89e0-d24df178ea5a,In managing my tasks and arranging them for me ,Neutral,Personal productivity and time management,Scheduling and reminders,,,,
664a1ca8-7088-47f3-8f9c-8b4abcae1099,In solving problems where you have to contact customer support.,Neutral,Decision-making and problem-solving,,,,,
d21efcab-10e8-4065-bd4f-b7712febc2ea,Increase productivity in the research element of areas of interest,Neutral,Information retrieval and research,,,,,
5f6aa2f8-fc2e-4d05-9977-941f8ccefd64,Information retrieval. ,Neutral,Information retrieval and research,,,,,
c2329b89-2ec8-444a-a23c-7cd84ce10656,It depend on the information you give and if it’s personal you yourself ,Neutral,Personalized recommendations and advice,,,,,
285204c8-59af-4cc9-8b55-c32d042cc9cf,"List making, reminders, re ordering shopping, managing my calendar.",Neutral,"Meal planning, nutrition, and grocery shopping",Personal organization and life admin,Scheduling and reminders,,,
b09b3023-7094-4083-bc1f-04733775a2e9,"Monitoring income and expenditure, goods coming into the home versus things going out, monitoring energy use and bills",Neutral,Financial planning and budgeting,Personal organization and life admin,,,,
5d47082d-5f54-4970-acd4-5909eab2f3a4,"My community work , the focus is food waste and related solutions.",Neutral,"Meal planning, nutrition, and grocery shopping",Other,,,,
