Participant ID,ResponseText,Sentiment,Tag 1,Tag 2,Tag 3,Tag 4,Tag 5,Tag 6
566ab0d5-82b7-4d5a-ae75-2690f5943605,I am optimistic about the future of AI assistance which would be most helpful when organising events and I can request details and a format can be made via AI for me so I can plan ahead. ,Neutral,Personal organization and life admin,Scheduling and reminders,Workplace efficiency and admin automation,,,
f8f7994d-bad6-4da1-b60e-9d28da3fcb20,I believe that AI should be more involved in local government budgets as that seems to be the primary source of waste in modern life. That way it could bring down local taxation making everybody's cost of living improve.,Neutral,Financial planning and budgeting,,,,,
457a1d5d-e685-4c59-b0f9-ae4f95c94cc1,"I think AI can be genuinely useful in optimising safe and efficient systems for running the background of people’s lives - ie. Smart appliances that can minimise usage of resources such as electricity.  I also do not feel human interaction is necessary for certain administrative chores.  Bank transactions, car and home insurances renewals can all be handled quickly and efficiently with AI, I appreciate its use where it can assist humans, not make decisions for humans.",Neutral,Automating repetitive and mundane tasks,Home automation and smart devices,Personal organization and life admin,Workplace efficiency and admin automation,,
99bab79c-70ca-4cb9-92a4-50d2a782d318,I think AI could check my work and help me with the kind of tasks that sometimes result in silly mistakes. My work would be more accurate and efficient.,Neutral,Data analysis and reporting,Personal productivity and time management,"Writing, editing, and communication support",,,
bd22975a-d945-42e4-8f9f-0462c5d19a9c,"I think I can use and AI assistant to help manage y lifestyle hobby of cycling, this is very important to me as it helps my mental health and stress levels, I use AI like a coach to design workouts, set long term goals, help with diet and nutrition, I have a very basic programme based on the above, in the future I expect AI can track what I do, make adjustments etc etc",Positive,"Meal planning, nutrition, and grocery shopping",Mental health and emotional support,Personalized recommendations and advice,,,
5836d659-f43c-451e-b926-cbcd5c529922,"I think a future AI assistant who knows about your personality, what you like and dislike etc that can have the same thoughts as you would be very helpful as they can make effective decisions for you e.g they can predict what career you will should be doing or predict what type of partner you should get ",Positive,Decision-making and problem-solving,"Job search, applications, and career support",Personalized recommendations and advice,,,
1e4647a9-96f7-4460-9012-133fbede2e5d,"I think in organisation in my family and work life, there are elements of having an AI assistant that would be hugely beneficial to me. Especially if it could work across multiple apps.",Neutral,Childcare and family management,Personal organization and life admin,Personal productivity and time management,Scheduling and reminders,,
571f6d7d-f9f3-4df5-adc4-3dbc4cbfb2d7,I think it could help me manage my social life a bit better and recommend how I can save money on home improvements and other areas.,Neutral,Companionship and social interaction,Financial planning and budgeting,,,,
2191ac10-19ac-47af-bc42-0fc0df57fae8,I think it would have to be in an administrative capacity. Maybe a personal AI could deal directly with a corporate AI to resolve issues with bills etc. Arrange change of addresses with multiple companies when moving ,Neutral,Automating repetitive and mundane tasks,Financial planning and budgeting,Personal organization and life admin,,,
44ef0cb8-b775-47e5-a9cd-82bc2a111e1b,I think managing finances could prove to be helpful or giving a financial forecast for the future. Helping me with learning something or teaching could also be beneficial ,Positive,"Education, learning, and tutoring",Financial planning and budgeting,,,,
9c36d44e-98da-4d23-8af2-318b5eb98619,I think medical diagnoses will be improved for the better and therefore will lead to greater health outcomes for society,Neutral,"Healthcare advice, diagnosis, and monitoring",,,,,
6babbae3-3bc6-4422-b622-d9a42b560999,"I think the mundane tasks of household finances would be a great area. To know that AI is handling my bills, finding the best deals and giving me advice on how to save money in the home would be great. Perhaps even controlling the lights and making sure they're turned off when I'm not in the room. Or, choosing the most cost effective time to start the washing machine.",Neutral,Financial planning and budgeting,Home automation and smart devices,Household chores and maintenance,Shopping assistance and deal finding,,
4eb5aafb-9c5f-487a-860a-d2b28c28ba26,"I use AI for my hobby, I can put in different synarios, sizes, colours and it helps me work out how much products I need to buy and use. When I ask it things it prompts me for further options, including photos or links on how to do a task I have asked it about. I use this now rather than google search engine as I trust Chat GPT understands my logic. If it throws me curve ball answer, that is not a bad thing actually as that has led to some further interesting searches. ",Neutral,Creative inspiration and content generation,Information retrieval and research,Personalized recommendations and advice,,,
fc9fc31b-715c-4892-be9f-2da18d80a0e1,"I would hope it will be useful to medical professionals, perhaps in helping to diagnose diseases",Neutral,"Healthcare advice, diagnosis, and monitoring",,,,,
e384261b-df56-40f8-9b52-47f192e30e53,"I would say increasing motivation and productivity in my life, for me to do the things I need and want to do, almost like a mentor that is tailored to encourage the best outcomes.",Positive,Mental health and emotional support,Personal productivity and time management,,,,
4bce6d38-a5f8-4411-a637-82853f2cdfb1,"In daily life, like my mornings and creating to do lists for me",Positive,Personal organization and life admin,Personal productivity and time management,Scheduling and reminders,,,
ac4e0d23-23a0-4d71-9543-fcc2cf075562,In health care acting as a triage assistant to improve through put in the NHS,Neutral,"Healthcare advice, diagnosis, and monitoring",,,,,
184f7212-4225-4a56-ba18-6c014105adeb,In helping me to rigorously think through strategic business questions and choices.,Positive,Decision-making and problem-solving,,,,,
41e736ee-7562-4d6e-a090-e44905d0015a,"In knowing how to deal with social issues (e.g. family, friends, responding to messages).",Neutral,Companionship and social interaction,Personalized recommendations and advice,,,,
e19e1a58-d0c2-43e4-a3c6-51a19b54ba00,"In my own words, one task where I’m most optimistic about future AI assistants is managing and simplifying complex planning. Whether it’s coordinating work projects, personal schedules, or even financial decisions, I often juggle lots of moving parts. A smarter AI could go beyond reminders and actually anticipate conflicts, suggest optimal timelines, and adapt plans as new information comes in. That kind of proactive, context-aware support would free up mental space for me to focus on creativity",Neutral,Financial planning and budgeting,Personal organization and life admin,Personal productivity and time management,Scheduling and reminders,,
953d4985-3056-421a-9539-ac3ac99d136f,In my work where it can assist or complete the writing of sales based text,Neutral,Workplace efficiency and admin automation,"Writing, editing, and communication support",,,,
ba338c89-3197-4113-869a-144190ff7bbe,"In my work, I create a lot of job titles and emails based on the work I am selling, AI could really help to obtain a unique selling point and differentiate it from its past.",Neutral,Creative inspiration and content generation,"Job search, applications, and career support","Writing, editing, and communication support",,,
76bacbe0-d4f4-43cc-b24d-3273dc922b01,In sorting out ordering problems ,Neutral,Automating repetitive and mundane tasks,Shopping assistance and deal finding,,,,
a772b149-e095-45b0-86d9-9f9b1b020143,It could help me learn new skills (by producing material that can test my knowledge) and optimise my language skills (by testing them and suggesting solutions for clear communication). ,Positive,"Education, learning, and tutoring","Writing, editing, and communication support",,,,
b420df14-bf36-4dc9-a1b2-85d7cd9a2517,"I’m not particularly optimistic about any area. Possibly life admin but I think people get lazy and don’t check if they’re not doing things themselves so if the assistant makes bad choices on my behalf, I may not notice for quite a long time. Can be helpful – it makes Internet searches a lot quicker – but it also removes peoples willingness and  ability to do those things for themselves and I don’t consider that to be a good thing. ",Negative,Information retrieval and research,Personal organization and life admin,Personal productivity and time management,,,
00707124-4c4a-4e63-bb45-2051ab889f4d,Just in improving life really. Maybe making things easier for me in terms of writing tasks but nothing specific I am thinking of that can be genuinely helpful. ,Neutral,Personal organization and life admin,Personal productivity and time management,"Writing, editing, and communication support",,,
6fc5e382-72d1-476e-babf-1c5a18217dc2,"Learning and teaching new concepts. When I learn a new skill (like investing/trading), I will find videos explaining key concepts and when I don't understand a specific point the AI is able to explain it in a much more simple, clear way. ",Neutral,"Education, learning, and tutoring",Financial planning and budgeting,Information retrieval and research,,,
364b513c-c9c1-41b4-af75-929dadae1ad1,"Like it is in it's current form but more so; a reliable information source without human biases and the need to troll through several SEO optimised websites to get the correct information, without adverts just information to help me. General advice that helps my life not someone's else's life via the ad revenue they make from my queries",Positive,Information retrieval and research,Personalized recommendations and advice,,,,
d8c5da33-5b1e-4bd9-8f50-593627b14d36,Meal planning. I think that an AI assistant can gather enough information about me and my family to help plan our weekly meals and create a shopping list to get what we need. ,Neutral,Childcare and family management,"Meal planning, nutrition, and grocery shopping",,,,
cf8d5670-3840-4ec6-8458-43a822291b4b,My biggest optimism is for a future AI assistant to genuinely help with personal project management and creative inspiration. I believe a truly helpful AI could analyze my thoughts and resources to not only organize tasks but also suggest innovative directions and connections I might not have considered.,Positive,Creative inspiration and content generation,Personal organization and life admin,Personal productivity and time management,,,
36e0b852-9448-4de3-be06-d087cc924925,Productivity when it comes to work. I believe  AI can simplify a lot of work-related tasks and save a lot of valuable time. I would be more concerned about using it in my personal life,Neutral,Personal productivity and time management,Workplace efficiency and admin automation,,,,
9cfb37fb-1d3b-4b5c-9a98-78202c379193,Research better deals,Neutral,Information retrieval and research,Shopping assistance and deal finding,,,,
1ea1d0e3-2404-4953-936d-8433875a3f1a,"Routine tasks at home, work that doesn’t need checking, to be done for me automatically ",Neutral,Automating repetitive and mundane tasks,Household chores and maintenance,,,,
e2fdbd8f-0863-4fbd-8897-30b29757d7cf,"Saving my family money by automating systems such as grocery shopping, paying bills etc and to get the best deal available.",Positive,Automating repetitive and mundane tasks,Creative inspiration and content generation,Financial planning and budgeting,"Meal planning, nutrition, and grocery shopping",Shopping assistance and deal finding,
4c191264-2ab8-4c4f-a73b-041489be509b,Searching for the best deal and renewing insurance policies.,Positive,Shopping assistance and deal finding,,,,,
ebdfd9a4-51e6-4267-b6d7-ebebcb3c8895,Time saving in repetitive situations,Positive,Automating repetitive and mundane tasks,,,,,
e9ddedcc-8769-42e6-be8d-21caa1ea0990,To help keep my calanda updated with my schedule and also help with my finances and savings ,Positive,Financial planning and budgeting,Personal organization and life admin,Scheduling and reminders,,,
f0d30144-b384-4ff4-a6c9-c7229d8cbba0,When I’m older reminding me of things like time and when to take medication ,Neutral,Scheduling and reminders,Supporting people with disabilities or aging,,,,
e8751b67-84d1-4789-a4ad-571ef2b661ab,When understanding and calculating my future pensions. ,Neutral,Decision-making and problem-solving,Financial planning and budgeting,,,,
40e71f53-d862-4ee9-bac5-802ccee6f875,Work productivity and automation of mundane tasks ,Neutral,Automating repetitive and mundane tasks,Workplace efficiency and admin automation,,,,
26939f73-5bf2-4706-aab7-40c00672074c,"Work stopping even more manual jobs, doing more detailed reporting and finding faults on its own without humans checking",Neutral,Automating repetitive and mundane tasks,Data analysis and reporting,Workplace efficiency and admin automation,,,
71e88329-488c-4bdd-8385-b9888b10116a,automated home,Neutral,Home automation and smart devices,,,,,
6df5e683-82c4-42ce-a98b-17b9deb8c758,general business and work purposes ,Neutral,Workplace efficiency and admin automation,,,,,
4c76fa07-4f7f-43fe-8a73-543204f201fb,health. Being able to retrieve information form an AI assist that otherwise would have to go to a GP or pharmacist to get or having to spend howurs searching the internet for and then verifying the information. ,Neutral,"Healthcare advice, diagnosis, and monitoring",Information retrieval and research,,,,
29053d4a-048d-422e-9769-f7ef236f7776,"i like to use the AI to be able to do things automatically in my house ie telling it to turn the lights on, alter the heating as i am disabled as this makes my life a lot easier",Positive,Home automation and smart devices,Supporting people with disabilities or aging,,,,
76ac20ae-73f4-4d35-92a4-7cc9e1df8704,"in analyzing videos better and better script writing, i want to be able to upload a video to an ai and it generates the best script for the video ",Positive,Creative inspiration and content generation,,,,,
43e9ee2d-ea9c-4697-896b-f3ead3215a22,in medicine - automate diagnostic reporting ,Neutral,Data analysis and reporting,"Healthcare advice, diagnosis, and monitoring",,,,
c602f862-f772-4b99-ac9f-95ede116649f,"maybe finding information that would take me hours ie researching travel plans, or medical information or recipes",Neutral,"Healthcare advice, diagnosis, and monitoring",Information retrieval and research,"Meal planning, nutrition, and grocery shopping",Travel and holiday planning,,
c4deaee5-1b60-422d-8cb2-2b293e1b770b,obtaining information and communicating formally with others,Neutral,Information retrieval and research,"Writing, editing, and communication support",,,,
8c4f1dc2-739a-4838-b434-23bd87a33b10,AI can be helpful in a medical/ health setting and it is already being used in this area.It must however be stringently regulated to prevent abuse and harm to the general public ,Neutral,"Healthcare advice, diagnosis, and monitoring",,,,,
7a80881d-b517-4729-9292-8e1e5dfa6e6d,AI would be very helpful in assisting me to work out what I could do with my dementia patients at every stage of their illness. It could help make suggestions as to what activities would be suitable at each stage to help them get the most out of life without it being to much for them.,Neutral,Entertainment and leisure recommendations,Personalized recommendations and advice,Supporting people with disabilities or aging,,,
76e06f8e-b9fc-4682-887a-ce2f4b02ece5,Automated bill payment and general domestic minutiae,Neutral,Automating repetitive and mundane tasks,Personal organization and life admin,,,,
7285c6a3-9ce0-45f6-81a9-03c2282caa24,"Because I am now retired and starting to age, I see AI being most useful to me in helping to provide answers and possibly direction in making decisions about my health and finances. I have asked for advice on managing my pension fund (it did not provide advice but simply repeated the known tax rules). I’ve used it to suggest travel itineraries and provide inspiration for art projects (which it doesn’t do well at the moment).",Neutral,Creative inspiration and content generation,Financial planning and budgeting,Supporting people with disabilities or aging,Travel and holiday planning,,
bde7737d-f83d-40b4-a01a-60a45e9ef09e,Being able to take on mundane tasks like organising and booking things eg. If you are going on holiday and could say what you are after and your budget and it could come back with a few suggestions. It would save so much time,Positive,Automating repetitive and mundane tasks,Personal organization and life admin,Travel and holiday planning,,,
c70e04c3-c295-4443-a2ea-435676960b5b,"Definitely in my work life. I will continue to use AI to ask general knowledge type questions, but also to help support me in brainstorm ideas for planning, creating and delivering lessons across the curriculum. I will use it to make resources that are as up to date and engaging for pupils and will also incorporate lessons which use AI to teach pupils how to use it safely and effectively. What would take me an hour to prepare can now be done in at least half the time with AI.",Neutral,Creative inspiration and content generation,"Education, learning, and tutoring",Information retrieval and research,Workplace efficiency and admin automation,,
b3c339a6-41db-4ecb-ae58-197c0dc5a6b6,Filtering options based on my personal needs and likes.,Positive,Personalized recommendations and advice,,,,,
3f29c73d-444f-4232-9b70-5d142ea757b9,"Food shopping, calendar and remembering dates, managing emails",Neutral,"Meal planning, nutrition, and grocery shopping",Personal organization and life admin,Scheduling and reminders,,,
a81d6daf-5f54-46b7-ad4c-2d57dc604de5,For me it would be in the medical field. I think I can improve health care and could speed up the time taken to analyse test results. An AI assistant then give me those results and I could ask questions and it would explain them to me which is something that the doctor doesn’t have time to do. The AI could then help me with suggestions on how to improve my health and could help monitor it.,Neutral,"Healthcare advice, diagnosis, and monitoring",Personalized recommendations and advice,,,,
0e35d9bc-9bad-4f45-a9fb-b204716f0a6e,Giving advice on any problems you have before making a decision so that you can decide what you need to do next. It is like having a wise friend beside you,Positive,Decision-making and problem-solving,Personalized recommendations and advice,,,,
0fc62381-0220-4710-ab1e-b96b78f68883,Health related matters. This will be very useful to everyone in the future.,Neutral,"Healthcare advice, diagnosis, and monitoring",,,,,
c044adff-2975-47df-b087-84b7a0168007,"Healthcare. I think that the prospect of quicker and personally suited medical interventions, suggestions for treatment and diagnosis is really exciting. ",Neutral,"Healthcare advice, diagnosis, and monitoring",,,,,
49763eff-1fb0-45d7-abbd-0aedd13af33b,Help with research ,Neutral,Information retrieval and research,,,,,
d520d3a2-424f-44a7-83e0-5d8bd5a06415,Helping me understand situations better for mental health. As I can ask 24/7. There's no time limitation and I can ask 100+ questions.,Positive,Information retrieval and research,Mental health and emotional support,,,,
7eab3fe7-fca7-4f7d-becf-bbd7d7ae88e7,I am most optimistic that a future AI assistant could be a truly helpful personal tutor for learning new skills at my own pace,Positive,"Education, learning, and tutoring",,,,,
fed36cfb-e947-4331-a5a5-2422ed9884e9,I believe AI assistants could be beneficial in healthcare particularly in remote manners. I do not believe AI should be involved in surgical procedures but I think AI can offer support and suggestions to patients and aid in analysing results in order to free up wait times.,Neutral,"Healthcare advice, diagnosis, and monitoring",,,,,
6dfac543-8191-40b0-a7e3-705dd82e89f7,"I believe AI can be useful and that it should always be used to increase productivity, but not to replace people. I already use AI within my workplace to help reduce toil that allows me to focus my time on other activities.",Neutral,Automating repetitive and mundane tasks,Personal productivity and time management,Workplace efficiency and admin automation,,,
c212b7fa-6a8f-450e-a309-461a66379f17,I believe that an AI assistant can help me stay productive and achieve my goals in a much shorter time frame. I think an AI assistant can help increase socio economic mobility by giving people the opportunity to free assistance.,Positive,Decision-making and problem-solving,Personal productivity and time management,,,,
495d6f06-07e9-4ede-8130-49989e7062aa,"I have a family and one of the most tiresome activities is planning evening meals, especially when both parents work and time is tight after picking up children from school. I am looking forward to be able to use an AI that can assist in meal planning based on having the knowledge of the foods I have in the fridge / freezer / ambient. This will save time, and help the natural flow of the night time routine. ",Neutral,Childcare and family management,"Meal planning, nutrition, and grocery shopping",,,,
b8bec702-9f96-49d5-b664-83e8fbffeb46,I see huge potential in medicine where AI can outperform many tasks in terms of deep analysis of samples etc.,Positive,Data analysis and reporting,"Healthcare advice, diagnosis, and monitoring",,,,
b24e5285-c478-44fb-8d88-886833bf15b0,I think AI could be really helpful to the NHS in lots of areas.,Neutral,"Healthcare advice, diagnosis, and monitoring",,,,,
23bdda2d-9514-463b-be28-b775a0dd3fb9,"I think AI could have great success in healthcare, specific diagnostic healthcare, and in my lifetime could greatly improve the speed, efficacy, and success of diagnosing diseases and illness quickly and non-invasively.",Neutral,"Healthcare advice, diagnosis, and monitoring",,,,,
4f6fd0e8-6120-4708-b7b7-5127032c0ffc,I think I’m general daily management. Like with the cooking and loosing weight and also helping me be motivated or plan my day etc. ,Neutral,"Meal planning, nutrition, and grocery shopping",Personal organization and life admin,Personal productivity and time management,Personalized recommendations and advice,,
e0ab2807-c7e8-4f50-b07a-e4b5e57720af,"I think an AI assistant would be helpful in healthcare for individuals especially those with dementia or medical issues, it could be used to remind people to eat, drink, take medication which would increase their wellbeing ",Neutral,"Healthcare advice, diagnosis, and monitoring",Scheduling and reminders,Supporting people with disabilities or aging,,,
c0988b84-d404-4150-aee2-2f526601fb71,"I think healthcare will be much improved by AI in and out of hospitals.  Even in the home to advise when to take medications, make appointments or monitor conditions like diabetes.",Neutral,"Healthcare advice, diagnosis, and monitoring",Scheduling and reminders,Supporting people with disabilities or aging,,,
654c2fbf-bdfb-4a2c-b1f6-7e87b2ce5b01,I think that there is genuine potential benefit of reducing the silly amount of admin that UK doctors have to spend their time doing with AI automation and in identifying common diagnosis with scans. ,Neutral,Automating repetitive and mundane tasks,"Healthcare advice, diagnosis, and monitoring",Workplace efficiency and admin automation,,,
fe3a09b9-7e8c-4818-b56f-4161af023c7e,"I would like an AI assistant that could help me with my medical condition - track what I eat, my symptoms, give me reminders for my medication etc - all in one place, and link in with my doctors and hospital. ",Neutral,"Healthcare advice, diagnosis, and monitoring",Scheduling and reminders,,,,
8bbd935b-3f0f-41a0-9459-8d508b79bdd7,Improve wellbeing and risks aversion,Neutral,"Healthcare advice, diagnosis, and monitoring",Personalized recommendations and advice,,,,
60e9b803-a1e2-40cf-b3d9-6441cc74350f,In making some life out death situations Ai may be more appropriate in making certain diagnosis and on occasion making the final decision where human worry may delay a remedy or cure,Neutral,Decision-making and problem-solving,"Healthcare advice, diagnosis, and monitoring",,,,
c44c747d-091b-489c-8fa8-59faa2ce5e95,In my welfare in general day to day activities ,Neutral,Personal organization and life admin,Personal productivity and time management,,,,
444ef59e-cd31-4044-881c-38a277757951,In research works and instant communications,Neutral,Information retrieval and research,,,,,
0002747e-12c5-4666-a23b-fd3cd0ffd1b8,It can generate a CV about me that appears to be favourable and therefore my chance of getting a job will be better ,Neutral,"Job search, applications, and career support","Writing, editing, and communication support",,,,
e95ec22c-7c23-4b54-bba0-269c77ea042d,"It could help with creativity, with learning, with answering questions, explaining things and concepts to me.  My job is AI prof for now I’d say",Neutral,Creative inspiration and content generation,Decision-making and problem-solving,"Education, learning, and tutoring",Information retrieval and research,,
cdccb3a9-b6c4-4499-be88-d1299211052a,It is only useful for certain tasks like finding information and only using it as a tool rather than human replacement. ,Neutral,Information retrieval and research,,,,,
