Participant ID,ResponseText,Sentiment,Tag 1,Tag 2,Tag 3,Tag 4,Tag 5,Tag 6
ecbd495e-358e-4e1e-984b-efc5d2d49d7f,"In being an informed, balanced reference point - for signposting to other services or recommending actions. For example, it could be useful medically, or for wellbeing. It could provide recommendations for what to do about symptoms or help with developing healthy habits to live better.",Neutral,"Healthcare advice, diagnosis, and monitoring",Personalized recommendations and advice,,,,
86b0b652-a7dd-4ed6-b3ef-02bb4ba11aac,Organising information into categories ,Neutral,Personal organization and life admin,,,,,
00aff309-2e74-4a33-a772-dce06acb4b2d,"Automating email responses.

",Neutral,Automating repetitive and mundane tasks,Workplace efficiency and admin automation,"Writing, editing, and communication support",,,
c049179f-c75e-4d78-8ce8-433bd6c0107d,Automation of appointment making.,Neutral,Scheduling and reminders,,,,,
792ce058-6ef9-410a-bc26-02300654c7b2,"Factual information such as learning my daily routine and advising problems to me in advance, such as train delays or traffic hold-ups.",Positive,Decision-making and problem-solving,Information retrieval and research,Personal productivity and time management,Scheduling and reminders,,
e5d507be-3c3c-488b-b2f1-138c9a32306f,"Generation of information, assistance with tasks and speed of working clerically.",Neutral,Automating repetitive and mundane tasks,Information retrieval and research,Workplace efficiency and admin automation,,,
f0bad217-cd31-44b4-b1e1-82ed749317fa,"Helping with my work when I need to research information and automate some tasks, such as proofreading content I've created.",Positive,Information retrieval and research,Workplace efficiency and admin automation,"Writing, editing, and communication support",,,
4253e247-ed53-4a4c-b596-3c1ce1ee4843,"I think automating smaller jobs such as payroll or emails would be helpful, implementing it in smaller areas of your life would allow you more time to work on the bigger things and projects you may have without losing focus on other things.",Neutral,Automating repetitive and mundane tasks,Workplace efficiency and admin automation,,,,
2f57f483-d958-45b4-8d3f-146848ad35b3,"I think in general, the automation and voice guided use of technology will be beneficial and I’m optimistic. Will stop us from having to look at a screen constantly.",Neutral,Automating repetitive and mundane tasks,Home automation and smart devices,,,,
005b3495-3399-4096-a639-dbb356d47b51,"I think in medical care where appointments are a nightmare for surgeries and hospitals. It can help cut waiting times a lot. In my life for helping me write speeches for work as it really makes life easier for me, saves me loads of time",Neutral,"Healthcare advice, diagnosis, and monitoring",Workplace efficiency and admin automation,"Writing, editing, and communication support",,,
98877555-7013-4875-8e08-05d21947c97d,I want to use it to build software apps and I'm sure that it will be able to help with that,Neutral,Creative inspiration and content generation,,,,,
c30f6729-03c6-472b-b830-c4fec855b74f,"Improving work efficiencies in helping to quickly build automations and tools, and using to support my education and further professional development",Positive,"Education, learning, and tutoring","Job search, applications, and career support",Personal productivity and time management,Workplace efficiency and admin automation,,
4b6995c9-d0db-4bc5-9bb7-63d954e90859,In day to day questions and getting  instant assistance for certain topics,Positive,Personalized recommendations and advice,,,,,
50375d87-0f8e-4e8f-96d2-599ccf71761c,"In my work. It'll be able to help me generate content and ideas faster and more easily. It'll be able to check grammar and help me make edits, so I can work smarter or more efficiently. ",Neutral,Creative inspiration and content generation,Workplace efficiency and admin automation,"Writing, editing, and communication support",,,
364075be-b45c-40ab-b746-647a721ff494,Information gathering,Neutral,Information retrieval and research,,,,,
ba9902d1-a3b2-42b7-9015-4d545c9711ad,"It can be helpful in education, making work load for teachers less.",Neutral,"Education, learning, and tutoring",Workplace efficiency and admin automation,,,,
6a1d38b0-18f5-4e89-bce1-fc2bda7e2adb,Providing information and making admin tasks easier ,Positive,Information retrieval and research,Workplace efficiency and admin automation,,,,
cfb0eb0b-00bd-48b9-9e36-9e800e81c777,Providing information and reminders,Neutral,Information retrieval and research,Scheduling and reminders,,,,
b731b616-12a2-483f-af41-9aaf50398d73,"Providing society work easy access to unlimited information, provided in a format that works well for them. Ease of access and use to the masses",Positive,Information retrieval and research,,,,,
dd65bf21-345c-45e2-9834-9504b6e5acbf,"Summarise data and produce reports/programs to speed up development and decision-making. 

",Neutral,Data analysis and reporting,Workplace efficiency and admin automation,,,,
6baf805f-2aa2-4f8e-bc08-1f907c7e597d,That would be how data are analysed which would increase productivity at work. ,Neutral,Data analysis and reporting,Personal productivity and time management,,,,
a0eaf7f6-e00c-43cd-8e43-d7e2b0188fb1,it could be useful in helping government make good decisions at every certain time.,Positive,Decision-making and problem-solving,Legal and policy information simplification,,,,
33e4ee00-3584-4ce8-acae-3693b7e9f0ca,"productivity with work admin and processes - minutes, report writing, researching, drafting correspondance",Neutral,Personal productivity and time management,Workplace efficiency and admin automation,"Writing, editing, and communication support",,,
0a7301de-6929-4989-a3f6-06534789b31e,AI helping with creative media work by making research faster and easier by brainstorming ideas,Positive,Creative inspiration and content generation,Information retrieval and research,,,,
cd2f034e-467f-4f1f-9559-4fe2123c4e58,Advance coding,Neutral,Workplace efficiency and admin automation,,,,,
2797f1ec-cc58-4fc2-8d9d-5fe422d5311c,Answering daily questions and solving problems.,Neutral,Decision-making and problem-solving,Information retrieval and research,,,,
69892de9-67c3-4598-8e37-911ffcdfd8ed,"As an information tool it is already amazing and blows my mind.  It is also extremely helpful when composing letters, speeches, music/songs etc.",Positive,Creative inspiration and content generation,Information retrieval and research,"Writing, editing, and communication support",,,
afb4e7a5-f02c-45ad-934d-7b6731df138c,As everything is very fast paced these days I'd find it helpful if it kept me up to date with modern technology that could make my life easier.,Positive,Information retrieval and research,Personal productivity and time management,,,,
14d4f526-3218-49fa-8b13-75e4d494f5a2,Assist older people with administrative tasks. ,Neutral,Personal organization and life admin,Supporting people with disabilities or aging,,,,
fa337c7f-4627-49d6-81dc-780fb149a56f,"Assisting in healthcare, by creating patient notes and speeding up back office processes, to ensure that funding can be directed at the front line (i.e. patient care)",Neutral,"Healthcare advice, diagnosis, and monitoring",Workplace efficiency and admin automation,,,,
2dc608cc-c247-4cff-8730-962357fb1f5a,"At times when I experience writer's block, an AI assistant is useful in initiating a brainstorming round that can be developed further ",Neutral,Creative inspiration and content generation,,,,,
85f8f7d8-39c0-451e-861b-d960105bc95c,"Automating the generation of complicated and boring standard documents. It's getting reasonable at filling in forms and so on where you have to have a document in a standardised format. In programming, I've found it OK for things like ""makefiles"" which are tedious and complicated to do by hand.",Neutral,Automating repetitive and mundane tasks,Workplace efficiency and admin automation,"Writing, editing, and communication support",,,
34ebf74e-b90f-4acd-8694-2cc8fdeaae23,Basic life admin tasks like cancelling bills or utilities when due. ,Neutral,Automating repetitive and mundane tasks,Personal organization and life admin,,,,
9431a36a-865f-4388-b82a-d262e0c0dd2d,Customer service responses,Neutral,"Writing, editing, and communication support",,,,,
ef351d18-aed6-4821-9702-b11d398dda5d,"Daily organisation - ordering groceries, remind of appointments",Neutral,"Meal planning, nutrition, and grocery shopping",Personal organization and life admin,Scheduling and reminders,,,
fc70c3c2-f894-4221-be65-4f97200e42da,Diet and exercise. I think this is an area where it can be fully beneficial by providing me with accurate and reliable data to follow based on my needs.,Neutral,"Healthcare advice, diagnosis, and monitoring","Meal planning, nutrition, and grocery shopping",Personalized recommendations and advice,,,
a00f3163-7271-42a6-928d-557a35bd4d42,Finding out factual information when I research for holidays or other topics I am interested in basically leisure use,Neutral,Entertainment and leisure recommendations,Information retrieval and research,Travel and holiday planning,,,
612edfb8-2ae2-44d8-8e4b-fcbdb56759c9,"Finding out information about topics of interest, reminders about schedules, bills etc",Neutral,Financial planning and budgeting,Information retrieval and research,Personal organization and life admin,Personal productivity and time management,Scheduling and reminders,
f2d57aad-286d-4dd7-85f5-a92348144cb2,Formalising emails and sending messages to colleagues and business partners without having to re-read them too many times and spell check etc.,Neutral,"Writing, editing, and communication support",,,,,
77d93bc9-0375-41e2-b968-5a918cebdb06,General research tasks as it can quickly find answers then summarise so I don’t have to spend ages looking for what I want,Positive,Information retrieval and research,,,,,
f39ffdf8-f954-4bc9-aeff-2bf64fd94a4e,"Give correct, reliable, accurate and up to date lengthy answers to current questions.",Positive,Decision-making and problem-solving,,,,,
9676dff5-4a8a-45f4-858a-1f038ef6c60a,"Helping me plan/write to do lists, generate list of all bills etc. Help automate processes.",Positive,Automating repetitive and mundane tasks,Personal organization and life admin,Personal productivity and time management,Scheduling and reminders,,
2fccacf5-8c22-4217-abdb-483fc0ba32e7,"Helping me to review and compare things online quicker, automating small tasks that take up time",Positive,Automating repetitive and mundane tasks,Information retrieval and research,,,,
b0872a3c-f52b-43fa-913d-1716dd9e6e7e,Helping to understand and fill out any complicated paperwork required in day to day living. ,Positive,Legal and policy information simplification,Personal organization and life admin,,,,
93b93df5-8fce-4d07-a6f3-24545aa0406d,"Helping with productivity and automation, making everyday tasks and jobs easie,r and saving a lot of time in the process. ",Positive,Automating repetitive and mundane tasks,Personal productivity and time management,Workplace efficiency and admin automation,,,
2f323965-abbd-4611-a661-aa069001b711,Home automation ,Neutral,Home automation and smart devices,,,,,
32f5c8a5-6d76-46a9-90d9-1b246930a12b,I am hopeful that the advances in technology are being genuinely reported and that the opportunities for the NHS are as great as has been reported by the government. If so it should greatly help improve the service and reduce significantly the backlog that currently exists in this country.,Neutral,"Healthcare advice, diagnosis, and monitoring",Workplace efficiency and admin automation,,,,
38ca76b5-0629-4e70-a19e-f98e3191a9ca,I believe it could be helpful in booking appointments etc and also for quickly being able to fact check published information by government and public authorities ,Neutral,Information retrieval and research,Legal and policy information simplification,Scheduling and reminders,,,
e92b1eba-2cc1-4deb-91a3-ef01dc66c6e6,I feel AI could help me organise all of my appointments and tasks very well and keep me from missing them or being late.,Positive,Personal organization and life admin,Scheduling and reminders,,,,
d8306aa2-310a-4794-afce-c5b327cee16c,I feel ai can be useful having the app on my phone to ask questions or if need help on subjects I may not have the answers to ,Neutral,Information retrieval and research,,,,,
16087255-5766-4415-bf10-1d185e595305,I think generally automating a lot of manual intensive tasks and providing additional insight and decision-making opportunities for humans,Neutral,Automating repetitive and mundane tasks,Decision-making and problem-solving,,,,
63e1be16-0845-479f-b23d-314d040105b4,"I think in my work it has already improved my productivity. I would not trust it to do my job, as is, but as a tool for an expert to use it is very useful.",Neutral,Personal productivity and time management,Workplace efficiency and admin automation,,,,
2d065aae-f9b0-4947-9773-38b69955d74a,"I think in terms of having a digital helper, this is very useful",Positive,Companionship and social interaction,,,,,
03e6ca84-af63-48d1-a408-f20d96bbea6d,"I think in terms of healthcare, it could be useful, as it can help ensure you receive the care you need when you need it. This could help to reduce wait times in A&E, which could save lives and resources. However, I feel there are very few benefits beyond this.",Neutral,"Healthcare advice, diagnosis, and monitoring",,,,,
23953141-3198-4347-a0ce-d9e58cd13039,I think it would be really beneficial for general admin and day to day tasks ,Positive,Automating repetitive and mundane tasks,Personal organization and life admin,Personal productivity and time management,,,
1cd2410c-58be-472b-87fd-3b3e9ea89d5e,"I think one where I can automate more work tasks that require a lot of thinking and concentration. This will free up time for me, and reduce my stress levels.",Positive,Automating repetitive and mundane tasks,Personal productivity and time management,,,,
4a8ab586-e147-48da-9d7e-4a529685ca5d,"I think that AI could be helpful with automated responses to customers, especially when it is not an urgent manner that doesn't need a phone call

",Neutral,Automating repetitive and mundane tasks,"Writing, editing, and communication support",,,,
700cc29a-b1a6-4200-96f4-93e3343cd93a,"I would like it to learn and do my routine admin tasks, such as bills and financial matters. ",Neutral,Automating repetitive and mundane tasks,Financial planning and budgeting,Personal organization and life admin,,,
4ecc8a45-7ffb-41b0-be58-9382ba4ed0c7,"In day-to-day applications where the impact of a bad decision is trivial, such as navigation, shopping, report writing etc.",Neutral,Automating repetitive and mundane tasks,Information retrieval and research,Shopping assistance and deal finding,"Writing, editing, and communication support",,
63a21a1c-8b9f-41cf-9cd4-109054962867,In many areas but probably most useful to me is simplifying & breaking down complex information because my ADHD sometimes makes that impossible ,Neutral,Accessibility and support for neurodiversity,"Education, learning, and tutoring",Personal productivity and time management,,,
8be44eb4-0c28-4c47-9644-df57ed94b0b2,"In my limited experience - rapid information collation on a topic. For instance, I was recently researching volunteering opportunities. The AI assistant collated information on my options far faster than I could have done manually and presented choices along with pros and cons of each. It added useful checklists and a step by step guide to how to evaluate each option. It also suggested several aspects to think about that I hadn't considered - so it sped up the research process enormously",Neutral,Decision-making and problem-solving,Information retrieval and research,,,,
5c2e83a3-898e-4591-b490-0112f620db18,"In my tasks, helping me optimise how I work and correct my mistakes and help with blind spots",Positive,Decision-making and problem-solving,Personal productivity and time management,,,,
8ec0d364-5c0c-490b-bc74-05e59e3b7736,It could help with diagnosis of medical problems based on latest data. ,Neutral,"Healthcare advice, diagnosis, and monitoring",,,,,
702c2994-346d-4a10-a380-ef0b285c071b,It will speed up many tasks and make repetitive tasks more streamlined as it will be useful in diagnostics in health situations to make a faster diagnosis.,Positive,Automating repetitive and mundane tasks,"Healthcare advice, diagnosis, and monitoring",,,,
631310cc-73a2-4de4-9360-bcf91d89fc8d,"Making lesson plans, tracking and marking",Neutral,"Education, learning, and tutoring",,,,,
5746c694-5aac-4238-b83c-baed1137bd94,"Management of personal admin tasks. Paying bills, order groceries, monitoring finances. ",Neutral,Financial planning and budgeting,"Meal planning, nutrition, and grocery shopping",Personal organization and life admin,Personal productivity and time management,,
447740d9-34fe-4419-864f-de47566fc930,"Performing basic, menial automation. More advanced than just something that could be accomplished with a script, but still basic enough to not require much interaction or decision making.",Neutral,Automating repetitive and mundane tasks,,,,,
b3209eff-6ebb-4340-9fcd-b60c5d87a3aa,Possibly helping to answer my questions quicker without browsing ,Positive,Information retrieval and research,,,,,
354a50dc-3cee-4ff5-88c6-c6dbcdbf80ef,"Probably automation of menial tasks in work like responding to emails or data entry, but not the complex decision making. And outside of work maybe determining best price on insurance renewals and things",Neutral,Automating repetitive and mundane tasks,Financial planning and budgeting,Shopping assistance and deal finding,"Writing, editing, and communication support",,
1ceccd6c-d47c-4476-9a3e-dffeb79450c2,Researching and filling things for me without ne manually wasting time on it and giving clear information for things I ask for,Positive,Automating repetitive and mundane tasks,Information retrieval and research,,,,
b5fa0270-85e0-4a1b-bd80-2b291149537d,Researching major goals/tasks thoroughly and efficiently while taking less time  ,Positive,Information retrieval and research,Personal productivity and time management,,,,
362ef6c3-43e5-4919-89d8-a419db2425d0,Researching topics and collating data from multiple sources and generating an unbiased overview,Positive,Data analysis and reporting,Information retrieval and research,,,,
7e346a64-30df-4c99-9868-cc3b66ee47f6,"Seeking information, carrying out remedial tasks",Neutral,Automating repetitive and mundane tasks,Information retrieval and research,Personal productivity and time management,,,
b6a89eb3-bf2d-47f2-ad2f-a413b57ec8ba,Simple things like a shopping list and reminders,Neutral,"Meal planning, nutrition, and grocery shopping",Scheduling and reminders,,,,
ac0451b5-725f-461d-ab0d-1b9443e49685,"Small administrative tasks, or breaking down jargon into understandable terms",Neutral,Automating repetitive and mundane tasks,Information retrieval and research,Legal and policy information simplification,,,
3e0a401b-be28-402b-be62-15b5ee2e2fdb,Sorting through and ranking lots of data such as the best travel options etc,Neutral,Data analysis and reporting,Travel and holiday planning,,,,
20bb68c4-27e6-48f6-97ab-00fa599fd50e,Streamlining data flow sheets and organising spread sheets as well as assisting in research on different aspects of life ,Neutral,Automating repetitive and mundane tasks,Data analysis and reporting,Information retrieval and research,Personal organization and life admin,Personal productivity and time management,Workplace efficiency and admin automation
840f7ab7-7bb6-4c11-8dc3-ac04f442602f,"The AI could be helpful in organising my weekly diary, it can help me be better organised and maybe suggest to me different ways of doing things to help me save time.",Neutral,Personal organization and life admin,Personal productivity and time management,Scheduling and reminders,,,
0bda8660-9358-4f8f-81bd-5aed33f61e34,The ability to summarize & provide a basic outline and / or useful detail from numerous sources available and enough information to allow following up and conformation of any details.,Positive,Information retrieval and research,Personalized recommendations and advice,,,,
172c2631-4151-48fa-82db-11e971810d96,The speed in which it helps research important and valuable topics related to my work.,Positive,Information retrieval and research,,,,,
22389086-1c78-4c0f-83d3-65c13d4a0eca,With planning fun events and an itinerary for holidays. I have a young daughter so using AI to plan activities and find them for me will be very useful and save a lot of time looking through Google / web pages when it will do it for me and I can refine the data.,Positive,Childcare and family management,Entertainment and leisure recommendations,Travel and holiday planning,,,
56ee71a2-2db5-4719-be3a-19f2969c07af,facilitating simple data withdrawal from internet,Neutral,Information retrieval and research,,,,,
6b04435f-c5db-4b31-bf49-a15c762a055d,giving suggestions and recommendations for doing things to make my job easier and to improve efficiency. Ways for me to save money,Positive,Financial planning and budgeting,Personalized recommendations and advice,Shopping assistance and deal finding,Workplace efficiency and admin automation,,
fb72e384-dd72-4ecb-971a-cba59606153f,"helping with mundane tasks, like renewing insurance with the best deals",Positive,Automating repetitive and mundane tasks,Shopping assistance and deal finding,,,,
e14d83fb-87dd-45cb-b599-73071143055e,"information gathering and work products as well as giving humans other options they may not have thought about for personal, social and work commitments",Neutral,Decision-making and problem-solving,Information retrieval and research,Personal organization and life admin,Personal productivity and time management,,
80917bd5-7f61-4a61-b215-5a50c74a9d9e,"working alongside medical professionals using data to help guide diagnosis.

Using tools to save time like writing notes from meetings",Neutral,Data analysis and reporting,"Healthcare advice, diagnosis, and monitoring",Workplace efficiency and admin automation,,,
458cdc71-1509-41e9-9631-9ecdca9409d2,AI can be helpful for conducting online research tasks.,Neutral,Information retrieval and research,,,,,
0f3e282f-b07b-4d87-9f6b-5005a90ff3f1,"AI could be really useful for disabled people - it could help to create shopping lists if someone can't write; set reminders for someone who may struggle with memory. It could help make some technologies far more efficient and effective.
",Neutral,Accessibility and support for neurodiversity,Scheduling and reminders,Supporting people with disabilities or aging,,,
7868fb27-16f2-418a-985d-2cc9a147995f,Admin eg… form filling ,Neutral,Automating repetitive and mundane tasks,Workplace efficiency and admin automation,,,,
bef52519-d96a-4951-a813-42c73d5d0573,Always having someone to talk to about issues. I use it daily to just vent about problems and it’s so good. ,Neutral,Companionship and social interaction,Mental health and emotional support,,,,
08204e65-f22b-4c27-8d2b-e87e37f8360a,An AI assistant that helps with writing everyday stuff e.g. emails,Positive,"Writing, editing, and communication support",,,,,
daa1106d-275e-4450-8fb6-e1111d67b344,"Any situation where large sets of data need to be sifted, sorted and systematically analysed. For instance helping to pick out investment opportunities like stocks or crypto currency.",Neutral,Data analysis and reporting,Financial planning and budgeting,,,,
29939d7d-d707-40f7-abf6-9a5b6c6591b4,"As an assistant, booking appointments, travel, reminders. That sort of thing",Neutral,Personal organization and life admin,Scheduling and reminders,Travel and holiday planning,,,
03318d5c-a8f9-46f7-ba2e-dbf4b9fed545,Automate tasks that free up my time I.e admin so I can enjoy more of life ,Positive,Automating repetitive and mundane tasks,Personal organization and life admin,,,,
29f99bce-79fa-4fce-945f-0bcca2f3ec09,Automating low-value / menial household and professional admin tasks ,Neutral,Automating repetitive and mundane tasks,Personal organization and life admin,,,,
78b392e7-93be-4a90-bdf2-6c3f8c63d512,CARRYING MUNDATE STATISICAL OR RECORD KEEPING AND RETREIVAL TASKS,Neutral,Automating repetitive and mundane tasks,Data analysis and reporting,,,,
d9d50419-f6e3-42eb-8a97-c2e5c42c197c,"Cairifying long winded and drawn out legal points where lawyers get paid ££££ so as to make legal processes clearer and more accessible for people - may make it easier to mediate. Same with policies and procedures, they could be more universal and raise standards across healthcare, social care, education etc.",Neutral,"Healthcare advice, diagnosis, and monitoring",Legal and policy information simplification,,,,
d401e736-ef5f-43b5-9250-8b259790932b,"Collating information, taking meeting minutes ",Neutral,Information retrieval and research,Workplace efficiency and admin automation,,,,
7dfbf513-704d-484e-87dc-a0f1efa72df4,"Compiling health data/ symptoms, what I eat and how I exercise, using analysis capability, and helping me to be healthier and identify problems early. Being a proactive health partner.",Positive,Data analysis and reporting,"Healthcare advice, diagnosis, and monitoring",,,,
f6a814fb-f651-4db0-a44a-bff9fad0a868,"Completing online tasks relating to utility bills, car/home insurance, etc",Neutral,Personal organization and life admin,Workplace efficiency and admin automation,,,,
6f4a02d6-7b1a-48d8-962b-16dcd4534db7,Data analysis of big data files and ability to learn new subjects,Neutral,Data analysis and reporting,"Education, learning, and tutoring",,,,
